DOC_ID,CANONICAL,CONTEXT,FORMATTED,VERBATIM,CONTAINING_ELEMENT,PATH_TO_ELEMENT
NDAR_V02_0496,Pomona,"66. 2. Passengers on board the POMONA included Lord Pitt, eldest son of the E",Pomona,Pomona,note,/TaggedPDF-doc/div/doc[496]/note/ship
NDAR_V02_0497,Industry (Schooner),INVENTORY OF THE CARGO OF THE SCHOONER INDUSTRY An Inventory of the Schooner I,Industry,INDUSTRY,title,/TaggedPDF-doc/div/doc[497]/title/ship
NDAR_V02_0497,Industry (Schooner),Y An Inventory of the Schooner INDUSTRY CargoFrancis Buller Master Lately From,Industry,Industry,p2,/TaggedPDF-doc/div/doc[497]/p2/ship
NDAR_V02_0499,Raven (Sloop),"ctober 9, 1775. 4. H. M. Sloop RAVEN arrived at Boston on October 4 with dis",Raven,Raven,note,/TaggedPDF-doc/div/doc[499]/note[3]/ship[1]
NDAR_V02_0499,Cerberus,"all had been received earlier by H.M.S. CERBERUS , which arrived September 26, 1775. The",Cerberus,Cerberus,note,/TaggedPDF-doc/div/doc[499]/note[3]/ship[2]
NDAR_V02_0499,Dolphin (Brig),"6. Captain Wallace, of the brig DOLPHIN .",Dolphin,Dolphin,note,/TaggedPDF-doc/div/doc[499]/note[5]/ship
NDAR_V02_0502,Prince George (Ship),ed Army in Boston. 1. The ship PRINCE GEORGE .,Prince George,Prince George,note,/TaggedPDF-doc/div/doc[502]/note/ship
NDAR_V02_0510,Diligent (Schooner),"e committee referred, were the schooner DILIGENT and sloop Machias Liberty, commanded re",Diligent,Diligent,note,/TaggedPDF-doc/div/doc[510]/note[4]/ship[1]
NDAR_V02_0510,Machias Liberty (Sloop),"d, were the schooner Diligent and sloop MACHIAS LIBERTY , commanded respectively by Jeremiah O'B",Machias Liberty,Machias Liberty,note,/TaggedPDF-doc/div/doc[510]/note[4]/ship[2]
NDAR_V02_0510,Diligent (Schooner),"e committee referred, were the schooner DILIGENT and sloop Machias Liberty, commanded re",Diligent,Diligent,note,/TaggedPDF-doc/div/doc[510]/note[4]/ship[3]
NDAR_V02_0510,Machias Liberty (Sloop),"d, were the schooner Diligent and sloop MACHIAS LIBERTY , commanded respectively by Jeremiah O'B",Machias Liberty,Machias Liberty,note,/TaggedPDF-doc/div/doc[510]/note[4]/ship[4]
NDAR_V02_0515,Aurora (Ship),"2. Thomas Read was master of the ship AURORA , from London.",Aurora,Aurora,note,/TaggedPDF-doc/div/doc[515]/note/ship
NDAR_V02_0518,William (Ship),OUTH (No 32) The Ship WILLIAM by Norfolk Virginia 5th October 1775. ー,William,William,dl,/TaggedPDF-doc/div/doc[518]/dl/ship
NDAR_V02_0520,St. John (Schooner),"JOURNAL OF H.M. SCHOONER ST. JOHN , LIEUTENANT WILLIAM GRANT Octo",St. John,ST. JOHN,title,/TaggedPDF-doc/div/doc[520]/title/ship
NDAR_V02_0520,St. John,"miralty 51/4330. 2. Ibid., the ST. JOHN finally reached New Providence in the B",St. John,St. John,note,/TaggedPDF-doc/div/doc[520]/note/ship
NDAR_V02_0529,Canceaux,"EUTENANT HENRY MOWAT, H.M. ARMED VESSEL CANCEAUX Whereas the four New England G",Canceaux,CANCEAUX,title,/TaggedPDF-doc/div/doc[529]/title/ship
NDAR_V02_0530,Canceaux,MASTER'S LOG OF H.M. ARMED VESSEL CANCEAUX Octr 1775 Friday 6 Do [Moord i,Canceaux,CANCEAUX,title,/TaggedPDF-doc/div/doc[530]/title/ship
NDAR_V02_0535,Duke of York (Ship),tract tho not named. We bought the Ship DUKE OF YORK 3 Capt Higgins & sent her for Hamburg in,Duke of York,Duke of York,note,/TaggedPDF-doc/div/doc[535]/note[2]/ship[1]
NDAR_V02_0535,Mercury,"Decemmber 3, 1774, had bern called the MERCURY . Ships' Registers, HSP.",Mercury,Mercury,note,/TaggedPDF-doc/div/doc[535]/note[2]/ship[2]
NDAR_V02_0537,Tartar,"JOURNAL, OF H.M.S. TARTAR , CAPTAIN EDWARD MEDOWS October",Tartar,TARTAR,title,/TaggedPDF-doc/div/doc[537]/title/ship
NDAR_V02_0537,Tartar (Sloop),Campy wth 6 sail of transports & Sloop TARTAR At Noon Employd Working out of the Gut,Tartar,Tartar,note,/TaggedPDF-doc/div/doc[537]/note/ship[1]
NDAR_V02_0537,Tartar (Sloop),Campy wth 6 sail of transports & Sloop TARTAR At Noon Employd Working out of the Gut,Tartar,Tartar,note,/TaggedPDF-doc/div/doc[537]/note/ship[2]
NDAR_V02_0538,Lively,RAL SAMUEL GRAVES Sir LIVELY Penobscot Bay 7 October 177,Lively,Lively,dl,/TaggedPDF-doc/div/doc[538]/dl/ship
NDAR_V02_0541,Prince George (Ship),2. The barrels of flour on the ship PRINCE GEORGE .,Prince George,Prince George,note,/TaggedPDF-doc/div/doc[541]/note/ship
NDAR_V02_0544,Mercury,"SAMUEL GRAVES (Copy) MERCURY at Boston Octo. 7, 1775 Sir I",Mercury,Mercury,dl,/TaggedPDF-doc/div/doc[544]/dl/ship
NDAR_V02_0545,Preston,"ACARTNEY, R.N. (Copy) PRESTON Boston 7 October 1775",Preston,Preston,dl,/TaggedPDF-doc/div/doc[545]/dl/ship
NDAR_V02_0546,Falcon,"Subscriber an officer belonging to the FALCON ,2 being under the closest confinement i",Falcon,Falcon,note,/TaggedPDF-doc/div/doc[546]/note/ship
NDAR_V02_0547,Rose,"JOURNAL OF H.M.S. ROSE , CAPTAIN JAMES WALLACE October",Rose,ROSE,title,/TaggedPDF-doc/div/doc[547]/title/ship
NDAR_V02_0548,Swan (Sloop),"JOURNAL OF H.M. SLOOP SWAN , CAPTAIN JAMES AYSCOUGH Octr 1",Swan,SWAN,title,/TaggedPDF-doc/div/doc[548]/title/ship
NDAR_V02_0550,Glasgow,"JOURNAL OF H.M.S. GLASGOW , CAPTAIN TYRINGHAM HOWE 1775 O",Glasgow,GLASGOW,title,/TaggedPDF-doc/div/doc[550]/title/ship
NDAR_V02_0550,Rose,"t 1 weigh'd & Came to sail in Compy the ROSE , Swan, Bolt[on] Brigg & Tenders with 2",Rose,Rose,note,/TaggedPDF-doc/div/doc[550]/note/ship
NDAR_V02_0558,Cruizer (Sloop),"SAMUEL JOHNSTON Sir, CRUIZER Sloop of War in Cape Fear River, Octobe",Cruizer,Cruizer,dl,/TaggedPDF-doc/div/doc[558]/dl/ship
NDAR_V02_0559,Cruizer (Sloop),"JOURNAL OF H.M. SLOOP CRUIZER , CAPTAIN FRANCIS PARRY Octor 7",Cruizer,CRUIZER,title,/TaggedPDF-doc/div/doc[559]/title/ship
NDAR_V02_0559,Adventure (Brig),ort [Johnston] seiz'd the Brig ADVENTURE from St Ubes with salt; sent an officer,Adventure,Adventure,note,/TaggedPDF-doc/div/doc[559]/note/ship[1]
NDAR_V02_0559,Adventure (Brig),ort [Johnston] seiz'd the Brig ADVENTURE from St Ubes with salt; sent an officer,Adventure,Adventure,note,/TaggedPDF-doc/div/doc[559]/note/ship[2]
NDAR_V02_0560,Scorpion's,"ker-Coleman Papers, CW. 2. The SCORPION'S arrival at Bermuda on September 17, 177",Scorpion's,Scorpion's,note,/TaggedPDF-doc/div/doc[560]/note[1]/ship[1]
NDAR_V02_0560,Palliser (Transport),"North Carolina, convoying the transport PALLISER . The guns from Fort Johnston, at the mo",Palliser,Palliser,note,/TaggedPDF-doc/div/doc[560]/note[1]/ship[2]
NDAR_V02_0560,Scorpion (Sloop),emache Commander of his majesty's Sloop SCORPION 2 to Richard Fowle & Nathaniel Bell Esqu,Scorpion,Scorpion,note,/TaggedPDF-doc/div/doc[560]/note[1]/ship[3]
NDAR_V02_0560,Cruizer,"rt, and the Scorpion was to relieve the CRUIZER on that station. Graves's Conduct, I, 1",Cruizer,Cruizer,note,/TaggedPDF-doc/div/doc[560]/note[1]/ship[4]
NDAR_V02_0560,Scorpion (Sloop),emache Commander of his majesty's Sloop SCORPION 2 to Richard Fowle & Nathaniel Bell Esqu,Scorpion,Scorpion,note,/TaggedPDF-doc/div/doc[560]/note[1]/ship[5]
NDAR_V02_0560,Scorpion (Sloop),emache Commander of his majesty's Sloop SCORPION 2 to Richard Fowle & Nathaniel Bell Esqu,Scorpion,Scorpion,note,/TaggedPDF-doc/div/doc[560]/note[3]/ship
NDAR_V02_0560,Scorpion (Sloop),emache Commander of his majesty's Sloop SCORPION 2 to Richard Fowle & Nathaniel Bell Esqu,Scorpion,Scorpion,note,/TaggedPDF-doc/div/doc[560]/note[4]/ship
NDAR_V02_0560,Scorpion (Sloop),emache Commander of his majesty's Sloop SCORPION 2 to Richard Fowle & Nathaniel Bell Esqu,Scorpion,Scorpion,note,/TaggedPDF-doc/div/doc[560]/note[5]/ship
NDAR_V02_0561,Two Sisters,"e to work, and went on board the sloop [ TWO SISTERS ]. . . . We arrived at Martiniq",Two Sisters,Two Sisters,note,/TaggedPDF-doc/div/doc[561]/note[2]/ship
NDAR_V02_0562,Portland,"R OF GUADELOUPE AND MARTINIQUE PORTLAND , English Harbour Antigua 7h October 177",Portland,Portland,dl,/TaggedPDF-doc/div/doc[562]/dl/ship
NDAR_V02_0563,Washington (Brig),the armed Schooner the Eagle2 Brigg the WASHINGTON 1. You being appointed a Captain in the,Washington,Washington,src,/TaggedPDF-doc/div/doc[563]/src/ship[1]
NDAR_V02_0563,Fowey,"when the Washington was taken by H.M.S. FOWEY on December 4, 1775. 2. Eagle",Fowey,Fowey,src,/TaggedPDF-doc/div/doc[563]/src/ship[2]
NDAR_V02_0563,Eagle (Schooner),dale] Captain of the armed Schooner the EAGLE 2 Brigg the Washington1. You being appoi,Eagle,Eagle,note,/TaggedPDF-doc/div/doc[563]/note[1]/ship
NDAR_V02_0565,Phoenix (Sloop),"ptains were John Sheridan, of the sloop PHOENIX , Thomas Dowman, of the ship Charming Pe",Phoenix,Phoenix,note,/TaggedPDF-doc/div/doc[565]/note/ship[1]
NDAR_V02_0565,Charming Peggy (Ship),"oop Phoenix, Thomas Dowman, of the ship CHARMING PEGGY , and Joseph Bradford, of the brig Sea N",Charming Peggy,Charming Peggy,note,/TaggedPDF-doc/div/doc[565]/note/ship[2]
NDAR_V02_0565,Sea Nymph (Brig),"Peggy, and Joseph Bradford, of the brig SEA NYMPH (all on Graves's Prize List, II, 36-38,",Sea Nymph,Sea Nymph,note,/TaggedPDF-doc/div/doc[565]/note/ship[3]
NDAR_V02_0565,Tryal (Schooner),"New York, James Warden of the schooner TRYAL and G. Hurst, of the brig Polly, which",Tryal,Tryal,note,/TaggedPDF-doc/div/doc[565]/note/ship[4]
NDAR_V02_0565,Polly (Brig),", Bradford, Mullowny, Warden,2 and Brig POLLY , Hurst, for Madeira, besides about 50 s",Polly,Polly,note,/TaggedPDF-doc/div/doc[565]/note/ship[5]
NDAR_V02_0566,Roebuck (Ship),lty have Ordered his Majesty's Ship the ROEBUCK to be one of the Squadron under my comm,Roebuck,Roebuck,p2,/TaggedPDF-doc/div/doc[566]/p2[2]/ship
NDAR_V02_0567,Diligent (Schooner),"ssed. to be his Majesty's late Schooner DILIGENT , that the Rebels had taken some time ag",Diligent,Diligent,note,/TaggedPDF-doc/div/doc[567]/note/ship[1]
NDAR_V02_0567,Diligence,"f the transport was not the ""Diligent"" [ DILIGENCE ], which never came that far west, but W",Diligence,Diligence,note,/TaggedPDF-doc/div/doc[567]/note/ship[2]
NDAR_V02_0567,Hannah (Schooner),"r west, but Washintgon's armed schooner HANNAH , commanded by Captain Nicholson Brought",Hannah,Hannah,note,/TaggedPDF-doc/div/doc[567]/note/ship[3]
NDAR_V02_0568,Rose,"JOURNAL OF H.M.S. ROSE , CAPTAIN JAMES WALLACE October",Rose,ROSE,title,/TaggedPDF-doc/div/doc[568]/title/ship
NDAR_V02_0569,Swan (Sloop),"JOURNAL OF H.M. SLOOP SWAN , CAPTAIN JAMES AYSCOUGH Octr 1",Swan,SWAN,title,/TaggedPDF-doc/div/doc[569]/title/ship
NDAR_V02_0570,Glasgow,"JOURNAL OF H.M.S. GLASGOW , CAPTAIN TYRINGHAM HOWE 1775 O",Glasgow,GLASGOW,title,/TaggedPDF-doc/div/doc[570]/title/ship
NDAR_V02_0575,Argo,"TO CAPTAIN FRANCIS GRANT GORDON, H.M.S. ARGO By James Young Esqr Vice Admir",Argo,ARGO,title,/TaggedPDF-doc/div/doc[575]/title/ship
NDAR_V02_0578,Hannah,"ualitys, & will be ready to take in the HANNAH s Company & Stores in 12 or 14 days the",Hannah,Hannah,note,/TaggedPDF-doc/div/doc[578]/note[1]/ship
NDAR_V02_0578,Hannah,"ualitys, & will be ready to take in the HANNAH s Company & Stores in 12 or 14 days the",Hannah,Hannah,note,/TaggedPDF-doc/div/doc[578]/note[2]/ship[1]
NDAR_V02_0578,Hannah,"ualitys, & will be ready to take in the HANNAH s Company & Stores in 12 or 14 days the",Hannah,Hannah,note,/TaggedPDF-doc/div/doc[578]/note[2]/ship[2]
NDAR_V02_0578,Hannah,"ualitys, & will be ready to take in the HANNAH s Company & Stores in 12 or 14 days the",Hannah,Hannah,note,/TaggedPDF-doc/div/doc[578]/note[2]/ship[3]
NDAR_V02_0582,Preston,O PHILIP STEPHENS Sir PRESTON Boston 9 October 1775.,Preston,Preston,dl,/TaggedPDF-doc/div/doc[582]/dl/ship
NDAR_V02_0582,Nautilus,"t from Nantasket.On the 5th instant the NAUTILUS returned with three Brigs, two of them",Nautilus,Nautilus,note,/TaggedPDF-doc/div/doc[582]/note[2]/ship[1]
NDAR_V02_0582,Polly (Sloop),"es taken by the Nautilus were the sloop POLLY , George Walker, master, with coffee fro",Polly,Polly,note,/TaggedPDF-doc/div/doc[582]/note[2]/ship[2]
NDAR_V02_0582,Tryal (Schooner),"ndies to Philadelphia, and the schooner TRYAL , James Warden, master, with coffee, coc",Tryal,Tryal,note,/TaggedPDF-doc/div/doc[582]/note[2]/ship[3]
NDAR_V02_0583,Preston,4 PRESTON V. A. Gr,Preston,Preston,dl2,/TaggedPDF-doc/div/doc[583]/dl2/ship
NDAR_V02_0584,Canceaux,MASTER'S LOG OF H.M. ARMED VESSEL CANCEAUX Octr 1775 Monday 9th Cape Code,Canceaux,CANCEAUX,title,/TaggedPDF-doc/div/doc[584]/title/ship
NDAR_V02_0585,Rose,"JOURNAL OF H.M.S. ROSE , CAPTAIN JAMES WALLACE October",Rose,ROSE,title,/TaggedPDF-doc/div/doc[585]/title/ship
NDAR_V02_0586,Swan (Sloop),"JOURNAL OF H.M. SLOOP SWAN , CAPTAIN JAMES AYSCOUGH Octr 1",Swan,SWAN,title,/TaggedPDF-doc/div/doc[586]/title/ship
NDAR_V02_0591,Pennsylvania Packet,"nd easing her of the cargo. 1. PENNSYLVANIA PACKET , October 23, 1775. 2. The ship",Pennsylvania Packet,Pennsylvania Packet,src,/TaggedPDF-doc/div/doc[591]/src/ship
NDAR_V02_0591,Peggy (Ship),"October 23, 1775. 2. The ship PEGGY , William Barron, master.",Peggy,Peggy,note,/TaggedPDF-doc/div/doc[591]/note/ship
NDAR_V02_0593,Asia,"CAPTAIN GEORGE VANDEPUT, H.M.S. ASIA , TO VICE ADMIRAL SAMUEL GRAVES",Asia,ASIA,title,/TaggedPDF-doc/div/doc[593]/title/ship
NDAR_V02_0601,Nautilus,"s discovered by the British ship of war NAUTILUS , of twenty guns, who immediately bore d",Nautilus,Nautilus,note,/TaggedPDF-doc/div/doc[601]/note[2]/ship[1]
NDAR_V02_0601,Nautilus,"s discovered by the British ship of war NAUTILUS , of twenty guns, who immediately bore d",Nautilus,Nautilus,note,/TaggedPDF-doc/div/doc[601]/note[2]/ship[2]
NDAR_V02_0601,Nautilus,"s discovered by the British ship of war NAUTILUS , of twenty guns, who immediately bore d",Nautilus,Nautilus,note,/TaggedPDF-doc/div/doc[601]/note[3]/ship
NDAR_V02_0603,Nautilus (Sloop),"JOURNAL OF H.M. SLOOP NAUTILUS , CAPTAIN JOHN COLLINS October",Nautilus,NAUTILUS,title,/TaggedPDF-doc/div/doc[603]/title/ship
NDAR_V02_0604,Speedwell,APPRAISAL OF THE SPEEDWELL we The Subscribers Being desie,Speedwell,SPEEDWELL,title,/TaggedPDF-doc/div/doc[604]/title/ship
NDAR_V02_0604,Hancock (Schooner),"25, LC. 2. The armed schooner HANCOCK of Washington's fleet.",Hancock,Hancock,note,/TaggedPDF-doc/div/doc[604]/note/ship
NDAR_V02_0605,Eliza,APPRAISAL OF THE ELIZA we The Subscribers Being desie,Eliza,ELIZA,title,/TaggedPDF-doc/div/doc[605]/title/ship
NDAR_V02_0605,Franklin (Schooner),"13, LC. 2. The armed schooner FRANKLIN of Washington's fleet.",Franklin,Franklin,note,/TaggedPDF-doc/div/doc[605]/note/ship
NDAR_V02_0606,Washington (Brig),on Martindale commanding the armed brig WASHINGTON of,Washington,Washington,note,/TaggedPDF-doc/div/doc[606]/note/ship
NDAR_V02_0610,Katy (Sloop),ed vessels were the Rhode Island sloops KATY and Washington.,Katy,Katy,note,/TaggedPDF-doc/div/doc[610]/note/ship[1]
NDAR_V02_0610,Washington,"[&c.] Nichs Cooke 1. WASHINGTON Papers, LC. 2. The armed vesse",Washington,Washington,note,/TaggedPDF-doc/div/doc[610]/note/ship[2]
NDAR_V02_0612,Rose,"JOURNAL OF H.M.S. ROSE , CAPTAIN JAMES WALLACE October",Rose,ROSE,title,/TaggedPDF-doc/div/doc[612]/title/ship
NDAR_V02_0615,Asia,"SAMUEL GRAVES (Copy) ASIA New York Octor 10th 1775. Sir,",Asia,Asia,dl,/TaggedPDF-doc/div/doc[615]/dl/ship
NDAR_V02_0621,Scorpion (Ship),in Tollemache of His Majesty's Ship the SCORPION now lying in St Georges Harbour should,Scorpion,Scorpion,p,/TaggedPDF-doc/div/doc[621]/p[1]/ship
NDAR_V02_0626,Nautilus (Sloop),"JOURNAL OF H.M. SLOOP NAUTILUS , CAPTAIN JOHN COLLINS October",Nautilus,NAUTILUS,title,/TaggedPDF-doc/div/doc[626]/title/ship
NDAR_V02_0626,Charming Polly (Schooner),"iralty 51/629. 2. The schooner CHARMING POLLY , John Guliker, master, from Cayenne, no",Charming Polly,Charming Polly,note,/TaggedPDF-doc/div/doc[626]/note/ship
NDAR_V02_0627,Canceaux,MASTER'S LOG OF H.M. ARMED VESSEL CANCEAUX Octr 1775 Wednesday 11 Cape El,Canceaux,CANCEAUX,title,/TaggedPDF-doc/div/doc[627]/title/ship
NDAR_V02_0627,Halifax,Eterd Standing under the Cape made the HALIFAX 2 Sigl to Chace to the NE at 10 She bro,Halifax,Halifax,note,/TaggedPDF-doc/div/doc[627]/note/ship[1]
NDAR_V02_0627,Canceaux,"eutenant Henry Mowat, consisting of the CANCEAUX , armed transport Symmetry, armed sloop",Canceaux,Canceaux,note,/TaggedPDF-doc/div/doc[627]/note/ship[2]
NDAR_V02_0627,Symmetry (Transport),"isting of the Canceaux, armed transport SYMMETRY , armed sloop Spitfire, and brig Halifax",Symmetry,Symmetry,note,/TaggedPDF-doc/div/doc[627]/note/ship[3]
NDAR_V02_0627,Spitfire (Sloop),", armed transport Symmetry, armed sloop SPITFIRE , and brig Halifax. She had sailed from",Spitfire,Spitfire,note,/TaggedPDF-doc/div/doc[627]/note/ship[4]
NDAR_V02_0627,Halifax,Eterd Standing under the Cape made the HALIFAX 2 Sigl to Chace to the NE at 10 She bro,Halifax,Halifax,note,/TaggedPDF-doc/div/doc[627]/note/ship[5]
NDAR_V02_0628,Preston,"OF VICE ADMIRAL SAMUEL GRAVES [ PRESTON , Boston] The next day [October",Preston,Preston,dl,/TaggedPDF-doc/div/doc[628]/dl/ship
NDAR_V02_0629,Peggy (Ship),"s to be enquired into2 1. Ship PEGGY , William Barron, master. 2. Co",Peggy,Peggy,src,/TaggedPDF-doc/div/doc[629]/src/ship
NDAR_V02_0636,Kingsfisher (Sloop),"JOURNAL OF H.M. SLOOP KINGSFISHER , CAPTAIN JAMES MONTAGU Octobr",Kingsfisher,KINGSFISHER,title,/TaggedPDF-doc/div/doc[636]/title/ship
NDAR_V02_0637,Otter (Sloop),"JOURNAL OF H.M. SLOOP OTTER , CAPTAIN MATTHEW SQUIRE Octobe",Otter,OTTER,title,/TaggedPDF-doc/div/doc[637]/title/ship
NDAR_V02_0641,Hunter (Sloop),"JOURNAL OF H.M. SLOOP HUNTER , CAPTAIN THOMAS MACKENZIE Octr",Hunter,HUNTER,title,/TaggedPDF-doc/div/doc[641]/title/ship
NDAR_V02_0643,Two Brothers,APPRAISAL OF THE TWO BROTHERS we The Subscribers Being desie,Two Brothers,TWO BROTHERS,title,/TaggedPDF-doc/div/doc[643]/title/ship
NDAR_V02_0643,Lee (Schooner),"267, LC. 2. The armed schooner LEE of Washington's fleet.",Lee,Lee,note,/TaggedPDF-doc/div/doc[643]/note/ship
NDAR_V02_0644,Hawk,APPRAISAL OF THE HAWK we The Subscribers Being desie,Hawk,HAWK,title,/TaggedPDF-doc/div/doc[644]/title/ship
NDAR_V02_0644,Warren (Schooner),"141, LC. 2. The armed schooner WARREN of Washington's fleet.",Warren,Warren,note,/TaggedPDF-doc/div/doc[644]/note/ship
NDAR_V02_0649,Hannah (Schooner),if any. 1. The armed schooner HANNAH of Washington's fleet.,Hannah,Hannah,note,/TaggedPDF-doc/div/doc[649]/note/ship
NDAR_V02_0652,Nautilus,RAL SAMUEL GRAVES Sir NAUTILUS Boston Bay 12 Octr 1775 The 10,Nautilus,Nautilus,dl,/TaggedPDF-doc/div/doc[652]/dl/ship
NDAR_V02_0652,Nautilus,RAL SAMUEL GRAVES Sir NAUTILUS Boston Bay 12 Octr 1775 The 10,Nautilus,Nautilus,note,/TaggedPDF-doc/div/doc[652]/note/ship
NDAR_V02_0653,Harrison (Schooner),LL FOR IRON WORK FOR THE ARMED SCHOONER HARRISON OF WASHINGTON'S FLEET Dr The S,Harrison,HARRISON,title,/TaggedPDF-doc/div/doc[653]/title/ship
NDAR_V02_0653,Harrison,INGTON'S FLEET Dr The Schoonr. HARRISON to Stephen Sampson for Sundry Iron Work,Harrison,Harrison,src,/TaggedPDF-doc/div/doc[653]/src/ship
NDAR_V02_0654,Canceaux,MASTER'S LOG OF H.M. ARMED VESSEL CANCEAUX Remarks on Thursday 12 Octr. 1,Canceaux,CANCEAUX,title,/TaggedPDF-doc/div/doc[654]/title/ship
NDAR_V02_0664,Experiment,mpson EXPERIMENT John Wha,Experiment,Experiment,note,/TaggedPDF-doc/div/doc[664]/note[1]/ship
NDAR_V02_0667,Otter (Sloop),"JOURNAL OF H. M. SLOOP OTTER , CAPTAIN MATTHEW SQUIRE Octobe",Otter,OTTER,title,/TaggedPDF-doc/div/doc[667]/title/ship
NDAR_V02_0672,Canceaux,MASTER'S LOG OF H.M. ARMED VESSEL CANCEAUX Remarks Friday 13 Octr 1775,Canceaux,CANCEAUX,title,/TaggedPDF-doc/div/doc[672]/title/ship
NDAR_V02_0682,Preston,SIR GUY CARLETON Sir PRESTON at Boston 13 Octr 1775 I take,Preston,Preston,dl,/TaggedPDF-doc/div/doc[682]/dl/ship
NDAR_V02_0685,Peggy (Ship),"Cargo, to Norwich. 1. The ship PEGGY . See Pennsylvania Gazette, October 11,",Peggy,Peggy,note,/TaggedPDF-doc/div/doc[685]/note/ship
NDAR_V02_0697,Margaretta (Schooner),ITH THE CAPTURE OF THE BRITISH SCHOONER MARGARETTA D,Margaretta,MARGARETTA,title,/TaggedPDF-doc/div/doc[697]/title/ship
NDAR_V02_0698,Canceaux,MASTER'S LOG OF H.M. ARMED VESSEL CANCEAUX Octr 1775 Saturday 14 at Singl,Canceaux,CANCEAUX,title,/TaggedPDF-doc/div/doc[698]/title/ship
NDAR_V02_0702,Rose,"SAMUEL GRAVES (Copy) ROSE , Rhode Island 14th Octor 1775.",Rose,Rose,dl,/TaggedPDF-doc/div/doc[702]/dl/ship
NDAR_V02_0708,Fowey,"er of Captain George Montagu, of H.M.S. FOWEY . 2. An erroneous report.",Fowey,Fowey,src,/TaggedPDF-doc/div/doc[708]/src/ship
NDAR_V02_0709,William (Ship),MORE TO WILSON MILES CARY Ship WILLIAM off Norfolk. 14th October 1775 ー,William,William,dl,/TaggedPDF-doc/div/doc[709]/dl/ship
NDAR_V02_0711,Argo,"as been given them."" 1. H.M.S. ARGO . 2. See de Noziere to James Yo",Argo,Argo,note,/TaggedPDF-doc/div/doc[711]/note[1]/ship
NDAR_V02_0713,Canceaux,MASTER'S LOG OF H.M. ARMED VESSEL CANCEAUX Octr 1775 Sunday 15th Portland,Canceaux,CANCEAUX,title,/TaggedPDF-doc/div/doc[713]/title/ship
NDAR_V02_0717,Cerberus,"L GRAVES TO CAPTAIN JOHN SYMONS, H.M.S. CERBERUS You are hereby required and di",Cerberus,CERBERUS,title,/TaggedPDF-doc/div/doc[717]/title/ship
NDAR_V02_0724,Cherokee,TRICK TONYN [Extract] CHEROKEE in Rebellion Road 15th Octr 1775,Cherokee,Cherokee,dl,/TaggedPDF-doc/div/doc[724]/dl/ship
NDAR_V02_0724,Cherokee,TRICK TONYN [Extract] CHEROKEE in Rebellion Road 15th Octr 1775,Cherokee,Cherokee,note,/TaggedPDF-doc/div/doc[724]/note[3]/ship
NDAR_V02_0725,Cherokee,LEXANDER INNES TO JAMES PENMAN CHEROKEE Arm'd Ship in Rebellion Road 15th Octr,Cherokee,Cherokee,dl,/TaggedPDF-doc/div/doc[725]/dl/ship
NDAR_V02_0725,Polly (Sloop),d his name is John Wan ton of the Sloop POLLY & I pray God we may get him clear of th,Polly,Polly,p2,/TaggedPDF-doc/div/doc[725]/p2[1]/ship
NDAR_V02_0730,Canceaux,LE OF FALMOUTH (Copy) CANCEAUX Falmouth 16th October 1775.,Canceaux,Canceaux,dl,/TaggedPDF-doc/div/doc[730]/dl/ship
NDAR_V02_0731,Canceaux,MASTER'S LOG OF H.M. ARMED VESSEL CANCEAUX Octr 1775 Monday 16 Hog Island,Canceaux,CANCEAUX,title,/TaggedPDF-doc/div/doc[731]/title/ship
NDAR_V02_0732,Prince George (Ship),"ection, Annapolis. 2. The ship PRINCE GEORGE , with 1892 barrels of flour, had straye",Prince George,Prince George,note,/TaggedPDF-doc/div/doc[732]/note/ship
NDAR_V02_0734,Lynch,"3rd. The other armed Schooner named the LYNCH 2 and commanded by Captain Sellman, is t",Lynch,Lynch,note,/TaggedPDF-doc/div/doc[734]/note[1]/ship[1]
NDAR_V02_0734,Franklin,"n's mind. John Selman's command was the FRANKLIN ; Broughton's, the Hancock. The Lynch wa",Franklin,Franklin,note,/TaggedPDF-doc/div/doc[734]/note[1]/ship[2]
NDAR_V02_0734,Hancock,"mand was the Franklin; Broughton's, the HANCOCK . The Lynch was not commissioned until e",Hancock,Hancock,note,/TaggedPDF-doc/div/doc[734]/note[1]/ship[3]
NDAR_V02_0734,Lynch,"3rd. The other armed Schooner named the LYNCH 2 and commanded by Captain Sellman, is t",Lynch,Lynch,note,/TaggedPDF-doc/div/doc[734]/note[1]/ship[4]
NDAR_V02_0736,Prince George (Ship),tinental Congress. 2. The ship PRINCE GEORGE .,Prince George,Prince George,note,/TaggedPDF-doc/div/doc[736]/note/ship
NDAR_V02_0737,Cerberus,"L GRAVES TO CAPTAIN JOHN SYMONS, H.M.S. CERBERUS Notwithstanding my Order to yo",Cerberus,CERBERUS,title,/TaggedPDF-doc/div/doc[737]/title/ship
NDAR_V02_0749,Cruizer (Sloop),"tract] No Carolina CRUIZER Sloop of War, in Cape Fear River Octr 1",Cruizer,Cruizer,dl,/TaggedPDF-doc/div/doc[749]/dl/ship
NDAR_V02_0754,Canceaux,MASTER'S LOG OF H.M. ARMED VESSEL CANCEAUX Octr 1775 Tuesday 17 At single,Canceaux,CANCEAUX,title,/TaggedPDF-doc/div/doc[754]/title/ship
NDAR_V02_0762,Preston,"TO FRANCIS LEGGE Sir PRESTON at Boston Octr 17, 1775 Sir I",Preston,Preston,dl,/TaggedPDF-doc/div/doc[762]/dl/ship
NDAR_V02_0769,St. Lawrence (Schooner),"JOURNAL OF H.M. SCHOONER ST. LAWRENCE , LIEUTENANT JOHN GRAVES Octbr",St. Lawrence,ST. LAWRENCE,title,/TaggedPDF-doc/div/doc[769]/title/ship
NDAR_V02_0772,Canceaux,MASTER'S LOG OF H.M. ARMED VESSEL CANCEAUX Octr 1775 Wednesday 18,Canceaux,CANCEAUX,title,/TaggedPDF-doc/div/doc[772]/title/ship
NDAR_V02_0776,Preston,"ARD LE CRAS, R.N. Sir PRESTON Boston 18 October 1775.",Preston,Preston,dl,/TaggedPDF-doc/div/doc[776]/dl/ship
NDAR_V02_0788,Kingsfisher (Sloop),"JOURNAL OF H.M. SLOOP KINGSFISHER , CAPTAIN JAMES MONTAGU Octobr",Kingsfisher,KINGSFISHER,title,/TaggedPDF-doc/div/doc[788]/title/ship
NDAR_V02_0789,Tamar (Sloop),"JOURNAL OF H.M. SLOOP TAMAR , CAPTAIN EDWARD THORNBROUGH Oc",Tamar,TAMAR,title,/TaggedPDF-doc/div/doc[789]/title/ship
NDAR_V02_0792,Canceaux,SAMUEL GRAVES (Copy) CANCEAUX in Casco Bay 19th October 1775.,Canceaux,Canceaux,dl,/TaggedPDF-doc/div/doc[792]/dl/ship
NDAR_V02_0793,Canceaux,MASTER'S LOG OF H.M. ARMED VESSEL CANCEAUX Octr 1775 Thursday 19,Canceaux,CANCEAUX,title,/TaggedPDF-doc/div/doc[793]/title/ship
NDAR_V02_0793,Canceaux,"ccessor, Admiral Molyneux Shuldham. The CANCEAUX 's log states that the two sloops were m",Canceaux,Canceaux,note,/TaggedPDF-doc/div/doc[793]/note/ship[1]
NDAR_V02_0793,Halifax,"d all the rest in Company the Symmetry, HALIFAX , Spitfire, with two Schooners & two Slo",Halifax,Halifax,note,/TaggedPDF-doc/div/doc[793]/note/ship[2]
NDAR_V02_0810,Kingsfisher (Sloop),"une 25), Journal of His Majesty's sloop KINGSFISHER , PRO, Admiralty 51/506; also: ""The Coll",Kingsfisher,Kingsfisher,note,/TaggedPDF-doc/div/doc[810]/note[1]/ship
NDAR_V02_0810,Halifax,"e. 4. Tryon fled to the packet HALIFAX on October 18, 1775.",Halifax,Halifax,note,/TaggedPDF-doc/div/doc[810]/note[3]/ship
NDAR_V02_0817,Otter (Sloop),"JOURNAL OF H.M. SLOOP OTTER , CAPTAIN MATTHEW SQUIRE Octobe",Otter,OTTER,title,/TaggedPDF-doc/div/doc[817]/title/ship
NDAR_V02_0818,Kingsfisher (Sloop),"JOURNAL OF H.M. SLOOP KINGSFISHER , CAPTAIN JAMES MONTAGU Octobr",Kingsfisher,KINGSFISHER,title,/TaggedPDF-doc/div/doc[818]/title/ship
NDAR_V02_0826,Canceaux,MASTER'S LOG OF H.M. ARMED VESSEL CANCEAUX Octr 1775 Friday 20 At single,Canceaux,CANCEAUX,title,/TaggedPDF-doc/div/doc[826]/title/ship
NDAR_V02_0827,Scarborough,bedient Humble Servt SCARBOROUGH October 20th 1775 Reuben Fogg,Scarborough,Scarborough,dl2,/TaggedPDF-doc/div/doc[827]/dl2/ship
NDAR_V02_0836,Preston,TO FRANCIS LEGGE Sir PRESTON Boston 20th Octr 1775,Preston,Preston,dl,/TaggedPDF-doc/div/doc[836]/dl/ship
NDAR_V02_0845,Rebecca and Francis (Ship),"ober 30. 2. The transport ship REBECCA AND FRANCIS , George Hastings, master. 3. C",Rebecca and Francis,Rebecca and Francis,note,/TaggedPDF-doc/div/doc[845]/note[1]/ship
