DOC_ID,CANONICAL,CONTEXT,FORMATTED,VERBATIM,CONTAINING_ELEMENT,PATH_TO_ELEMENT
NDAR_V02_1320,Polly,3. The sloop Monmouth. 4. The POLLY and the Industry.,Polly,Polly,note,/TaggedPDF-doc/div/doc[1320]/note[3]/ship[1]
NDAR_V02_1320,Industry,Monmouth. 4. The Polly and the INDUSTRY .,Industry,Industry,note,/TaggedPDF-doc/div/doc[1320]/note[3]/ship[2]
NDAR_V02_1333,Dickinson (Boat),ointed 2nd Lieutenant to the armed Boat DICKINSON . Capt. [George] Hastings was t,Dickinson,Dickinson,p,/TaggedPDF-doc/div/doc[1333]/p[1]/ship
NDAR_V02_1334,William (Ship),"e.GIVEN under my Hand on board the Ship WILLIAM , off Norfolk, the 7th Day of November,",William,William,src,/TaggedPDF-doc/div/doc[1334]/src/ship[1]
NDAR_V02_1334,William (Ship),"e.GIVEN under my Hand on board the Ship WILLIAM , off Norfolk, the 7th Day of November,",William,William,src,/TaggedPDF-doc/div/doc[1334]/src/ship[2]
NDAR_V02_1336,Lizard,"ock Papers, III, LC. 2. H.M.S. LIZARD . 3. The Hunter, to which Arnol",Lizard,Lizard,note,/TaggedPDF-doc/div/doc[1336]/note[1]/ship
NDAR_V02_1336,Hunter,"2. H.M.S. Lizard. 3. The HUNTER , to which Arnold apparently refers, was",Hunter,Hunter,note,/TaggedPDF-doc/div/doc[1336]/note[2]/ship
NDAR_V02_1342,Charming Nancy (Transport),"AL KEPT ON BOARD THE ORDNANCE TRANSPORT CHARMING NANCY Wednesday 8 [November, 1775].",Charming Nancy,CHARMING NANCY,title,/TaggedPDF-doc/div/doc[1342]/title/ship
NDAR_V02_1342,Charming Nancy,"ms on Each side of the Deck 1. CHARMING NANCY Journal, NYHS. 2. Cape Ann and",Charming Nancy,Charming Nancy,src,/TaggedPDF-doc/div/doc[1342]/src/ship
NDAR_V02_1343,Phoebe,"Washington Papers, LC. 2. The PHOEBE .",Phoebe,Phoebe,note,/TaggedPDF-doc/div/doc[1343]/note/ship
NDAR_V02_1345,Monmouth (Sloop),"Papers, II, LC. 2. The sloops MONMOUTH and North Britain respectively.",Monmouth,Monmouth,note,/TaggedPDF-doc/div/doc[1345]/note[1]/ship[1]
NDAR_V02_1345,North Britain,LC. 2. The sloops Monmouth and NORTH BRITAIN respectively. 3. See Captain J,North Britain,North Britain,note,/TaggedPDF-doc/div/doc[1345]/note[1]/ship[2]
NDAR_V02_1349,Washin[g]ton (Brig),Occasion of a Cruize On Board the Brig WASHIN[G]TON Capt. Sion Martindall the 8 of November,Washin[g]ton,Washin[g]ton,src,/TaggedPDF-doc/div/doc[1349]/src/ship[1]
NDAR_V02_1349,Washington (Brig),. Manvide was surgeon of the armed brig WASHINGTON of,Washington,Washington,src,/TaggedPDF-doc/div/doc[1349]/src/ship[2]
NDAR_V02_1351,Preston,"O PHILIP STEPHENS Sir PRESTON Boston Novr 8, 1775,",Preston,Preston,dl,/TaggedPDF-doc/div/doc[1351]/dl/ship
NDAR_V02_1351,Hinchinbrook,which I hope he will be able to do.The HINCHINBROOK e Schooner commanded by Lieutenant [Alex,Hinchinbrook,Hinchinbrook,note,/TaggedPDF-doc/div/doc[1351]/note[2]/ship[1]
NDAR_V02_1351,Adventure,"e directed them to be exchanged for the ADVENTURE s Guns, which being four pounders are fi",Adventure,Adventure,note,/TaggedPDF-doc/div/doc[1351]/note[2]/ship[2]
NDAR_V02_1351,Hope (Schooner),ther Arties on board Got 6 men from the HOPE Schooner & 6 from the Preston at ½ past,Hope,Hope,note,/TaggedPDF-doc/div/doc[1351]/note[2]/ship[3]
NDAR_V02_1351,Preston,"O PHILIP STEPHENS Sir PRESTON Boston Novr 8, 1775,",Preston,Preston,note,/TaggedPDF-doc/div/doc[1351]/note[2]/ship[4]
NDAR_V02_1351,Adventure,"e directed them to be exchanged for the ADVENTURE s Guns, which being four pounders are fi",Adventure,Adventure,note,/TaggedPDF-doc/div/doc[1351]/note[2]/ship[5]
NDAR_V02_1357,Lizard (Ship),"ted to me the use of his Majesty's Ship LIZARD , and desiring my Stay to protect, as mu",Lizard,Lizard,dl2,/TaggedPDF-doc/div/doc[1357]/dl2/ship
NDAR_V02_1358,Lizard,PHILIP STEPHENS Copy LIZARD 9th Novr 1775. ー Sir Be pleas,Lizard,Lizard,dl,/TaggedPDF-doc/div/doc[1358]/dl/ship
NDAR_V02_1359,Hunter (Sloop),"JOURNAL OF H.M. SLOOP HUNTER , CAPTAIN THOMAS MACKENZIE Novr",Hunter,HUNTER,title,/TaggedPDF-doc/div/doc[1359]/title/ship
NDAR_V02_1360,Two Sisters (Schooner),"on Papers, LC. 2. The schooner TWO SISTERS , Robert Robins, master.",Two Sisters,Two Sisters,note,/TaggedPDF-doc/div/doc[1360]/note/ship
NDAR_V02_1361,Prince William (Schooner),"n Papers, LC. 2. The schooners PRINCE WILLIAM and Mary. 3. The sloop Ranger,",Prince William,Prince William,note,/TaggedPDF-doc/div/doc[1361]/note[1]/ship[1]
NDAR_V02_1361,Mary,"2. The schooners Prince William and MARY . 3. The sloop Ranger, William",Mary,Mary,note,/TaggedPDF-doc/div/doc[1361]/note[1]/ship[2]
NDAR_V02_1361,Ranger (Sloop),"William and Mary. 3. The sloop RANGER , William McGlathry, master.",Ranger,Ranger,note,/TaggedPDF-doc/div/doc[1361]/note[2]/ship
NDAR_V02_1363,North Britain,"n Ritchie and John Ritchie, Jr., of the NORTH BRITAIN .",North Britain,North Britain,note,/TaggedPDF-doc/div/doc[1363]/note/ship
NDAR_V02_1364,Polly (Sloop),. 2. The prizes were the sloop POLLY and the schooner Industry. 3.,Polly,Polly,note,/TaggedPDF-doc/div/doc[1364]/note[1]/ship[1]
NDAR_V02_1364,Industry (Schooner),s were the sloop Polly and the schooner INDUSTRY . 3. For a further description,Industry,Industry,note,/TaggedPDF-doc/div/doc[1364]/note[1]/ship[2]
NDAR_V02_1364,Harrison (Schooner),"r a further description of the schooner HARRISON , in picturesque language, see Coit to S",Harrison,Harrison,note,/TaggedPDF-doc/div/doc[1364]/note[2]/ship
NDAR_V02_1369,Preston,"NDER GRAEME, R.N. Sir PRESTON , Boston 9 Novr 1775. I have re",Preston,Preston,dl,/TaggedPDF-doc/div/doc[1369]/dl/ship
NDAR_V02_1369,Mercury,"er of this date acquainting me that the MERCURY is so foul she often misses Stays, goes",Mercury,Mercury,p2,/TaggedPDF-doc/div/doc[1369]/p2/ship
NDAR_V02_1370,Scarborough,"JOURNAL OF H. M. S. SCARBOROUGH , CAPTAIN ANDREW BARKLEY Novr 7",Scarborough,SCARBOROUGH,title,/TaggedPDF-doc/div/doc[1370]/title/ship
NDAR_V02_1371,Scarborough,TO VICE ADMIRAL SAMUEL GRAVES SCARBOROUGH Charles Town River Novemr 9,Scarborough,Scarborough,dl,/TaggedPDF-doc/div/doc[1371]/dl/ship
NDAR_V02_1372,Lively,"JOURNAL OF H.M.S. LIVELY , CAPTAIN THOMAS BISHOP Novr 17",Lively,LIVELY,title,/TaggedPDF-doc/div/doc[1372]/title/ship
NDAR_V02_1372,Lively,"on in Penobscot Bay under convoy of the LIVELY , having been in that bay and river sinc",Lively,Lively,note,/TaggedPDF-doc/div/doc[1372]/note/ship
NDAR_V02_1373,Charming Nancy (Transport),AL KEPT ON BOARD THE ORDNANCE TRANSPORT CHARMING NANCY Thursday 9 Novr [1775] Rainy,Charming Nancy,CHARMING NANCY,title,/TaggedPDF-doc/div/doc[1373]/title/ship
NDAR_V02_1373,Charming Nancy,"killed at the above Affair. 1. CHARMING NANCY Journal, NYHS.",Charming Nancy,Charming Nancy,src,/TaggedPDF-doc/div/doc[1373]/src/ship
NDAR_V02_1380,Kingfisher (Sloop),"Extract from the journal of H.M. sloop KINGFISHER ; ""November 9, 1775. At Singl Anchor in",Kingfisher,Kingfisher,src,/TaggedPDF-doc/div/doc[1380]/src/ship
NDAR_V02_1382,St. Lawrence (Schooner),"olina, 59-62. 2. H.M. Schooner ST. LAWRENCE , Lieutenant John Graves.",St. Lawrence,St. Lawrence,note,/TaggedPDF-doc/div/doc[1382]/note/ship
NDAR_V02_1383,Tamar (Sloop),"CAPTAIN EDWARD THORNBROUGH, H.M. SLOOP TAMAR Sir, Charlestown, Nov",Tamar,TAMAR,title,/TaggedPDF-doc/div/doc[1383]/title/ship
NDAR_V02_1384,Lizard,O PHILIP STEPHENS Sir LIZARD at Quebec the 10th Novemr 1775,Lizard,Lizard,dl,/TaggedPDF-doc/div/doc[1384]/dl/ship
NDAR_V02_1387,Harrison (Schooner),"2. Washington's armed schooner HARRISON , William Coit. 3. The schooner",Harrison,Harrison,note,/TaggedPDF-doc/div/doc[1387]/note[1]/ship
NDAR_V02_1387,Two Sisters (Schooner),"William Coit. 3. The schooner TWO SISTERS , Robert Robbins, master.",Two Sisters,Two Sisters,note,/TaggedPDF-doc/div/doc[1387]/note[2]/ship
NDAR_V02_1388,Phoebe (Sloop),"ngton Papers, LC. 2. The sloop PHOEBE . 3. The schooner Two Sisters.",Phoebe,Phoebe,note,/TaggedPDF-doc/div/doc[1388]/note[1]/ship
NDAR_V02_1388,Two Sisters (Schooner),sloop Phoebe. 3. The schooner TWO SISTERS .,Two Sisters,Two Sisters,note,/TaggedPDF-doc/div/doc[1388]/note[2]/ship
NDAR_V02_1389,Two Sisters (Schooner),"s, Mass. Arch. 2. The schooner TWO SISTERS . 3. The act was written as a r",Two Sisters,Two Sisters,note,/TaggedPDF-doc/div/doc[1389]/note[1]/ship
NDAR_V02_1389,North Britain (Schooner),"everly, who had brought in the schooner NORTH BRITAIN .",North Britain,North Britain,note,/TaggedPDF-doc/div/doc[1389]/note[2]/ship
NDAR_V02_1391,Prince William (Schooner),"ccount of the captures of the schooners PRINCE WILLIAM and Mary, and the sloop Phoebe, made by",Prince William,Prince William,note,/TaggedPDF-doc/div/doc[1391]/note[1]/ship[1]
NDAR_V02_1391,Mary,"res of the schooners Prince William and MARY , and the sloop Phoebe, made by Broughto",Mary,Mary,note,/TaggedPDF-doc/div/doc[1391]/note[1]/ship[2]
NDAR_V02_1391,Phoebe (Sloop),"Prince William and Mary, and the sloop PHOEBE , made by Broughton and Selman, in Washi",Phoebe,Phoebe,note,/TaggedPDF-doc/div/doc[1391]/note[1]/ship[3]
NDAR_V02_1391,Hancock (Schooner),"Selman, in Washington's armed schooners HANCOCK and Franklin. 3. This was John",Hancock,Hancock,note,/TaggedPDF-doc/div/doc[1391]/note[1]/ship[4]
NDAR_V02_1391,Franklin,ashington's armed schooners Hancock and FRANKLIN . 3. This was John Manley's rec,Franklin,Franklin,note,/TaggedPDF-doc/div/doc[1391]/note[1]/ship[5]
NDAR_V02_1391,Ranger (Sloop),as John Manley's recapture of the sloop RANGER ; not that of Captain Adams named in the,Ranger,Ranger,note,/TaggedPDF-doc/div/doc[1391]/note[2]/ship
NDAR_V02_1391,Polly (Sloop),ed in the letter. 4. The sloop POLLY and schooner Industry.,Polly,Polly,note,/TaggedPDF-doc/div/doc[1391]/note[3]/ship[1]
NDAR_V02_1391,Industry (Schooner),4. The sloop Polly and schooner INDUSTRY .,Industry,Industry,note,/TaggedPDF-doc/div/doc[1391]/note[3]/ship[2]
NDAR_V02_1392,Cerberus,"JOURNAL OF H.M.S. CERBERUS , CAPTAIN JOHN SYMONS Novr 75 W",Cerberus,CERBERUS,title,/TaggedPDF-doc/div/doc[1392]/title/ship
NDAR_V02_1392,Nancy (Brig),"y 51/181. 2. The ordnance brig NANCY , subsequently taken by John Manley in W",Nancy,Nancy,note,/TaggedPDF-doc/div/doc[1392]/note[1]/ship[1]
NDAR_V02_1392,Lee,e points of the Main Sl gave way on the LEE Side by which the Sl Split at 10 carry,Lee,Lee,note,/TaggedPDF-doc/div/doc[1392]/note[1]/ship[2]
NDAR_V02_1392,Cerberus,"lip Stephens on December 28, 1775: ""The CERBERUS had the Ordnance Brig under Convoy seve",Cerberus,Cerberus,note,/TaggedPDF-doc/div/doc[1392]/note[2]/ship
NDAR_V02_1393,Providence,HODE ISLAND HOUSE OF ASSEMBLY [ PROVIDENCE ] Novemr 10h 1775 To the House,Providence,Providence,note,/TaggedPDF-doc/div/doc[1393]/note/ship
NDAR_V02_1394,Rose,"JOURNAL OF H.M.S. ROSE , CAPTAIN JAMES WALLACE Novr 17",Rose,ROSE,title,/TaggedPDF-doc/div/doc[1394]/title/ship
NDAR_V02_1400,Otter (Sloop),"JOURNAL OF H.M. SLOOP OTTER , CAPTAIN MATTHEW SQUIRE Novemb",Otter,OTTER,title,/TaggedPDF-doc/div/doc[1400]/title/ship
NDAR_V02_1404,Savage,acquaint the commanding officer of the SAVAGE they are to Succeed you. 1. Ha,Savage,Savage,p2,/TaggedPDF-doc/div/doc[1404]/p2[2]/ship
NDAR_V02_1405,Hinchinbrook (Schooner),"JOURNAL OF H.M. SCHOONER HINCHINBROOK , LIEUTENANT ALEXANDER ELLIS No",Hinchinbrook,HINCHINBROOK,title,/TaggedPDF-doc/div/doc[1405]/title/ship
NDAR_V02_1406,Hancock (Schooner),Selman in Washington's armed schooners HANCOCK and Franklin. Devereux was second lieut,Hancock,Hancock,note,/TaggedPDF-doc/div/doc[1406]/note/ship[1]
NDAR_V02_1406,Franklin,ashington's armed schooners Hancock and FRANKLIN . Devereux was second lieutenant of the,Franklin,Franklin,note,/TaggedPDF-doc/div/doc[1406]/note/ship[2]
NDAR_V02_1406,Hancock (Schooner),Selman in Washington's armed schooners HANCOCK and Franklin. Devereux was second lieut,Hancock,Hancock,note,/TaggedPDF-doc/div/doc[1406]/note/ship[3]
NDAR_V02_1407,Franklin,man. Homan was second lieutenant of the FRANKLIN .,Franklin,Franklin,note,/TaggedPDF-doc/div/doc[1407]/note/ship
NDAR_V02_1408,Ranger (Sloop),"k Papers, II, LC. 2. The sloop RANGER . 3. See copy of the act, Novem",Ranger,Ranger,note,/TaggedPDF-doc/div/doc[1408]/note[1]/ship
NDAR_V02_1408,North Britain (Schooner),"4. The references are to the schooner NORTH BRITAIN , carried into Beverly (not Plymouth), a",North Britain,North Britain,note,/TaggedPDF-doc/div/doc[1408]/note[3]/ship[1]
NDAR_V02_1408,Two Sisters (Schooner),"to Beverly (not Plymouth), and schooner TWO SISTERS . 5. Washinton writing about th",Two Sisters,Two Sisters,note,/TaggedPDF-doc/div/doc[1408]/note[3]/ship[2]
NDAR_V02_1409,Two Sisters (Schooner),"on Papers, LC. 2. The schooner TWO SISTERS .",Two Sisters,Two Sisters,note,/TaggedPDF-doc/div/doc[1409]/note/ship
NDAR_V02_1412,Two Sisters (Schooner),"II, 1531-1532. 2. The schooner TWO SISTERS . 3. Extracts of these intercep",Two Sisters,Two Sisters,note,/TaggedPDF-doc/div/doc[1412]/note[1]/ship
NDAR_V02_1412,Pennsylvania Packet,"ngress November 20, were printed in the PENNSYLVANIA PACKET , November 27, 1775.",Pennsylvania Packet,Pennsylvania Packet,note,/TaggedPDF-doc/div/doc[1412]/note[2]/ship
NDAR_V02_1413,Two Sisters (Schooner),"ember 1, 1775. 3. The schooner TWO SISTERS , from Ireland for Boston with provision",Two Sisters,Two Sisters,note,/TaggedPDF-doc/div/doc[1413]/note[2]/ship
NDAR_V02_1414,Preston,"GE VANDEPUT, R.N. Sir PRESTON Boston November 11, 1775.",Preston,Preston,dl,/TaggedPDF-doc/div/doc[1414]/dl/ship
NDAR_V02_1414,Asia,d better take up his abode on board the ASIA until he can reside on shore with Secur,Asia,Asia,p2,/TaggedPDF-doc/div/doc[1414]/p2/ship
NDAR_V02_1415,Preston,"MES WALLACE, R.N. Sir PRESTON Boston 11 Novr 1775",Preston,Preston,dl,/TaggedPDF-doc/div/doc[1415]/dl/ship
NDAR_V02_1415,Raven,the Rebellion until the arrival of the RAVEN on the 4th of October issued from himse,Raven,Raven,note,/TaggedPDF-doc/div/doc[1415]/note/ship[1]
NDAR_V02_1415,Phoenix,"bey the Admiralty Orders brought by the PHOENIX .""",Phoenix,Phoenix,note,/TaggedPDF-doc/div/doc[1415]/note/ship[2]
NDAR_V02_1416,Scarborough,"HOWE TO CAPTAIN ANDREW BARKLEY, H.M.S. SCARBOROUGH (Copy) Boston Novr 11",Scarborough,SCARBOROUGH,title,/TaggedPDF-doc/div/doc[1416]/title/ship
NDAR_V02_1421,Glasgow,"JOURNAL OF H.M.S. GLASGOW , CAPTAIN TYRINGHAM HOWE Novemb",Glasgow,GLASGOW,title,/TaggedPDF-doc/div/doc[1421]/title/ship
NDAR_V02_1421,Glasgow's,"ty 51/398. 2. According to the GLASGOW'S journal, May and Hannon returned on boa",Glasgow's,Glasgow's,note,/TaggedPDF-doc/div/doc[1421]/note/ship
NDAR_V02_1425,Dutchess of Gordon (Ship),"[Extract] On Board the Ship DUTCHESS OF GORDON New York Harbour Nov 11, 17",Dutchess of Gordon,Dutchess of Gordon,dl,/TaggedPDF-doc/div/doc[1425]/dl/ship
NDAR_V02_1432,St. Lawrence (Schooner),"JOURNAL OF H.M. SCHOONER ST. LAWRENCE , LIEUTENANT JOHN GRAVES Novr 1",St. Lawrence,ST. LAWRENCE,title,/TaggedPDF-doc/div/doc[1432]/title/ship
NDAR_V02_1433,Cerberus,"arks Transcript, HU. 2. H.M.S. CERBERUS . 3. Letter continued November",Cerberus,Cerberus,note,/TaggedPDF-doc/div/doc[1433]/note[1]/ship
NDAR_V02_1435,Two Sisters,"s Letters, II, 425-427. 2. The TWO SISTERS had been captured by the armed schooner",Two Sisters,Two Sisters,note,/TaggedPDF-doc/div/doc[1435]/note[1]/ship[1]
NDAR_V02_1435,Lee (Schooner),"had been captured by the armed schooner LEE , John Manley. 3. A reference t",Lee,Lee,note,/TaggedPDF-doc/div/doc[1435]/note[1]/ship[2]
NDAR_V02_1436,Nancy (Brig),"to Sea immediately to look for the Brig NANCY ,2 and have given directions to set her",Nancy,Nancy,note,/TaggedPDF-doc/div/doc[1436]/note/ship
NDAR_V02_1439,Cruizer (Sloop),tract] No Carolina CRUIZER Sloop of War in Cape Fear River Novembe,Cruizer,Cruizer,dl,/TaggedPDF-doc/div/doc[1439]/dl/ship
NDAR_V02_1439,Scorpion (Sloop),"hips bound thither, or to this Port.The SCORPION Sloop of War arrived here yesterday fro",Scorpion,Scorpion,note,/TaggedPDF-doc/div/doc[1439]/note/ship[1]
NDAR_V02_1439,Palliser (Transport),"the bar his Majtys sloop Scorpion, the PALLISER transport, & a ship with Emigrants from",Palliser,Palliser,note,/TaggedPDF-doc/div/doc[1439]/note/ship[2]
NDAR_V02_1439,Cruizer (Sloop),tract] No Carolina CRUIZER Sloop of War in Cape Fear River Novembe,Cruizer,Cruizer,note,/TaggedPDF-doc/div/doc[1439]/note/ship[3]
NDAR_V02_1440,Tamar (Sloop),2. See the journal of H.M. Sloop TAMAR for November 11 and 12 under November 1,Tamar,Tamar,note,/TaggedPDF-doc/div/doc[1440]/note/ship
NDAR_V02_1441,Defence (Schooner),"Tufts, commander of the colony scooner DEFENCE , mounted with two nine-pounders, six si",Defence,Defence,p,/TaggedPDF-doc/div/doc[1441]/p[2]/ship[1]
NDAR_V02_1441,Tamer (Ship),"ing about gunshot from the King's ships TAMER of sixteen, and the Cherokee of six gun",Tamer,Tamer,p,/TaggedPDF-doc/div/doc[1441]/p[2]/ship[2]
NDAR_V02_1441,Cherokee,"King's ships Tamer of sixteen, and the CHEROKEE of six guns. ー As Captain Tufts approac",Cherokee,Cherokee,p,/TaggedPDF-doc/div/doc[1441]/p[2]/ship[3]
NDAR_V02_1441,Tamer (Ship),"ing about gunshot from the King's ships TAMER of sixteen, and the Cherokee of six gun",Tamer,Tamer,p,/TaggedPDF-doc/div/doc[1441]/p[2]/ship[4]
NDAR_V02_1441,Tamer (Ship),"ing about gunshot from the King's ships TAMER of sixteen, and the Cherokee of six gun",Tamer,Tamer,p,/TaggedPDF-doc/div/doc[1441]/p[2]/ship[5]
NDAR_V02_1441,Tamer (Ship),"ing about gunshot from the King's ships TAMER of sixteen, and the Cherokee of six gun",Tamer,Tamer,p,/TaggedPDF-doc/div/doc[1441]/p[2]/ship[6]
NDAR_V02_1441,Cherokee,"King's ships Tamer of sixteen, and the CHEROKEE of six guns. ー As Captain Tufts approac",Cherokee,Cherokee,p,/TaggedPDF-doc/div/doc[1441]/p[2]/ship[7]
NDAR_V02_1441,Tamer (Ship),"ing about gunshot from the King's ships TAMER of sixteen, and the Cherokee of six gun",Tamer,Tamer,p,/TaggedPDF-doc/div/doc[1441]/p[2]/ship[8]
NDAR_V02_1441,Tamer (Ship),"ing about gunshot from the King's ships TAMER of sixteen, and the Cherokee of six gun",Tamer,Tamer,p,/TaggedPDF-doc/div/doc[1441]/p[2]/ship[9]
NDAR_V02_1441,Cherokee,"King's ships Tamer of sixteen, and the CHEROKEE of six guns. ー As Captain Tufts approac",Cherokee,Cherokee,p,/TaggedPDF-doc/div/doc[1441]/p[2]/ship[10]
NDAR_V02_1441,Tamer (Ship),"ing about gunshot from the King's ships TAMER of sixteen, and the Cherokee of six gun",Tamer,Tamer,p,/TaggedPDF-doc/div/doc[1441]/p[2]/ship[11]
NDAR_V02_1441,Cherokee,"King's ships Tamer of sixteen, and the CHEROKEE of six guns. ー As Captain Tufts approac",Cherokee,Cherokee,p,/TaggedPDF-doc/div/doc[1441]/p[2]/ship[12]
NDAR_V02_1444,Two Sisters,"Washington Papers, LC. 2. The TWO SISTERS . 3. In the William Bartlett Pa",Two Sisters,Two Sisters,note,/TaggedPDF-doc/div/doc[1444]/note[1]/ship
NDAR_V02_1444,North Britain,"there are two receipts relating to the NORTH BRITAIN , one undated, and the other dated Novem",North Britain,North Britain,note,/TaggedPDF-doc/div/doc[1444]/note[2]/ship[1]
NDAR_V02_1444,Britton,o such Vessells brought in as the North BRITTON I shall with Pleasure comply with your,Britton,Britton,note,/TaggedPDF-doc/div/doc[1444]/note[2]/ship[2]
NDAR_V02_1444,North Britton,gard to such Vessells brought in as the NORTH BRITTON I shall with Pleasure comply with your,North Britton,North Britton,note,/TaggedPDF-doc/div/doc[1444]/note[2]/ship[3]
NDAR_V02_1445,Prince William (Schooner),"517, BHS. 2. Owner of schooner PRINCE WILLIAM . 3. Owner of schooner Mary.",Prince William,Prince William,note,/TaggedPDF-doc/div/doc[1445]/note[1]/ship
NDAR_V02_1445,Mary (Schooner),William. 3. Owner of schooner MARY . 4. Master of the sloop Phoebe,Mary,Mary,note,/TaggedPDF-doc/div/doc[1445]/note[2]/ship
NDAR_V02_1445,Phoebe (Sloop),r Mary. 4. Master of the sloop PHOEBE . 5. Master of sloop Warren.,Phoebe,Phoebe,note,/TaggedPDF-doc/div/doc[1445]/note[3]/ship
NDAR_V02_1445,Warren (Sloop),oop Phoebe. 5. Master of sloop WARREN . 6. Passenger in the sloop,Warren,Warren,note,/TaggedPDF-doc/div/doc[1445]/note[4]/ship
NDAR_V02_1445,Warren (Sloop),oop Phoebe. 5. Master of sloop WARREN . 6. Passenger in the sloop,Warren,Warren,note,/TaggedPDF-doc/div/doc[1445]/note[5]/ship
NDAR_V02_1445,Speedwell (Sloop),"Warren. 7, Master of the sloop SPEEDWELL .",Speedwell,Speedwell,note,/TaggedPDF-doc/div/doc[1445]/note[6]/ship
NDAR_V02_1446,Sally (Sloop),MITMENT OF PRISONERS TAKEN IN THE SLOOP SALLY Colony of the Massachusetts-Ba,Sally,SALLY,title,/TaggedPDF-doc/div/doc[1446]/title/ship
NDAR_V02_1446,Sally (Sloop),the Prisoners lately taken in the Sloop SALLY (excepting the Woman) and brought into,Sally,Sally,p,/TaggedPDF-doc/div/doc[1446]/p/ship
NDAR_V02_1447,Two Sisters,"port, December 29, 1775, ー ""Also of the TWO SISTERS , Robins, from Corke to Boston, being ta",Two Sisters,Two Sisters,note,/TaggedPDF-doc/div/doc[1447]/note[1]/ship
NDAR_V02_1447,North Britain (Schooner),"nuary 1, 1776. 2. The schooner NORTH BRITAIN . 3. Extract from the Diary of",North Britain,North Britain,note,/TaggedPDF-doc/div/doc[1447]/note[2]/ship
NDAR_V02_1448,Harrison (Schooner),", LC. 2. In the armed schooner HARRISON of Washington's fleet.",Harrison,Harrison,note,/TaggedPDF-doc/div/doc[1448]/note/ship
NDAR_V02_1451,Black Prince,"adelphia] Novr 13th. 1775. The BLACK PRINCE , a large Ship, is fitting to carry 20 N",Black Prince,Black Prince,note,/TaggedPDF-doc/div/doc[1451]/note[1]/ship[1]
NDAR_V02_1451,Alfred,"f Drowne's letter, had been renamed the ALFRED by the Naval Committee of Congress. The",Alfred,Alfred,note,/TaggedPDF-doc/div/doc[1451]/note[1]/ship[2]
NDAR_V02_1451,Black Prince,"adelphia] Novr 13th. 1775. The BLACK PRINCE , a large Ship, is fitting to carry 20 N",Black Prince,Black Prince,note,/TaggedPDF-doc/div/doc[1451]/note[2]/ship
NDAR_V02_1451,Black Prince,"adelphia] Novr 13th. 1775. The BLACK PRINCE , a large Ship, is fitting to carry 20 N",Black Prince,Black Prince,note,/TaggedPDF-doc/div/doc[1451]/note[6]/ship
NDAR_V02_1451,Black Prince,"adelphia] Novr 13th. 1775. The BLACK PRINCE , a large Ship, is fitting to carry 20 N",Black Prince,Black Prince,note,/TaggedPDF-doc/div/doc[1451]/note[8]/ship
NDAR_V02_1451,Black Prince,"adelphia] Novr 13th. 1775. The BLACK PRINCE , a large Ship, is fitting to carry 20 N",Black Prince,Black Prince,note,/TaggedPDF-doc/div/doc[1451]/note[10]/ship
NDAR_V02_1451,Black Prince,"adelphia] Novr 13th. 1775. The BLACK PRINCE , a large Ship, is fitting to carry 20 N",Black Prince,Black Prince,note,/TaggedPDF-doc/div/doc[1451]/note[13]/ship
NDAR_V02_1451,Alfred,"f Drowne's letter, had been renamed the ALFRED by the Naval Committee of Congress. The",Alfred,Alfred,note,/TaggedPDF-doc/div/doc[1451]/note[15]/ship
NDAR_V02_1451,Alfred,"f Drowne's letter, had been renamed the ALFRED by the Naval Committee of Congress. The",Alfred,Alfred,note,/TaggedPDF-doc/div/doc[1451]/note[21]/ship
NDAR_V02_1451,Alfred,"f Drowne's letter, had been renamed the ALFRED by the Naval Committee of Congress. The",Alfred,Alfred,note,/TaggedPDF-doc/div/doc[1451]/note[26]/ship
NDAR_V02_1451,Alfred,"f Drowne's letter, had been renamed the ALFRED by the Naval Committee of Congress. The",Alfred,Alfred,note,/TaggedPDF-doc/div/doc[1451]/note[28]/ship
NDAR_V02_1452,Prince George (Ship),g the disposal of prizes after the ship PRINCE GEORGE was captured in October.,Prince George,Prince George,note,/TaggedPDF-doc/div/doc[1452]/note/ship
NDAR_V02_1459,Tamar (Sloop),"JOURNAL OF H.M. SLOOP TAMAR , CAPTAIN EDWARD THORNBROUGH 17",Tamar,TAMAR,title,/TaggedPDF-doc/div/doc[1459]/title/ship
NDAR_V02_1463,Lizard,"JOURNAL OF H.M.S. LIZARD , CAPTAIN JOHN HAMILTON Novembe",Lizard,LIZARD,title,/TaggedPDF-doc/div/doc[1463]/title/ship
NDAR_V02_1466,Industry (Schooner),EXAMINATION OF THE CREW OF THE SCHOONER INDUSTRY Colony of the Massachusetts Ba,Industry,INDUSTRY,title,/TaggedPDF-doc/div/doc[1466]/title/ship
NDAR_V02_1467,Polly (Sloop),EXAMINATION OF THE CREW OF THE SLOOP POLLY Colony of the Massachusetts-Ba,Polly,POLLY,title,/TaggedPDF-doc/div/doc[1467]/title/ship
NDAR_V02_1467,Polly,"vol. 164, 193. On November 5, 1775 the POLLY was taken by Washington's armed schoone",Polly,Polly,src,/TaggedPDF-doc/div/doc[1467]/src/ship[1]
NDAR_V02_1467,Harrison (Schooner),as taken by Washington's armed schooner HARRISON .,Harrison,Harrison,src,/TaggedPDF-doc/div/doc[1467]/src/ship[2]
NDAR_V02_1472,Rose (Ship),"OF NEWPORT His Majesty's Ship ROSE , Nov. 14, 1775. I will suspend",Rose,Rose,dl,/TaggedPDF-doc/div/doc[1472]/dl/ship
NDAR_V02_1477,Kings Fisher,"RAL SAMUEL GRAVES Sir KINGS FISHER , off James Town Virginia the 14th",Kings Fisher,Kings Fisher,dl,/TaggedPDF-doc/div/doc[1477]/dl/ship
NDAR_V02_1477,Adonis (Brig),losure] An Invoice of the Brig ADONIS 's Cargo 2000 Bushels of Salt,Adonis,Adonis,p2,/TaggedPDF-doc/div/doc[1477]/p2/ship
NDAR_V02_1477,Betsey (Brig),"r letters and papers, on board the brig BETSEY , sent into Beverly by John Manley.",Betsey,Betsey,src,/TaggedPDF-doc/div/doc[1477]/src/ship
NDAR_V02_1477,Temperance,Beverly by John Manley. 2. The TEMPERANCE .,Temperance,Temperance,note,/TaggedPDF-doc/div/doc[1477]/note/ship
NDAR_V02_1478,Kingsfisher,"W. GRIFFIN TO GEORGE GEFFERINA KINGSFISHER James Town, Virginia, 14. N",Kingsfisher,Kingsfisher,dl,/TaggedPDF-doc/div/doc[1478]/dl/ship
NDAR_V02_1478,Kingsfisher,"W. GRIFFIN TO GEORGE GEFFERINA KINGSFISHER James Town, Virginia, 14. N",Kingsfisher,Kingsfisher,src,/TaggedPDF-doc/div/doc[1478]/src/ship[1]
NDAR_V02_1478,Betsey (Brig),"ers and papers, on board the prize brig BETSEY , sent into Beverly by John Manley.",Betsey,Betsey,src,/TaggedPDF-doc/div/doc[1478]/src/ship[2]
NDAR_V02_1478,Polly (Sloop),"2. The inquiry respecting the sloop POLLY , taken in August. She was bound from Ne",Polly,Polly,note,/TaggedPDF-doc/div/doc[1478]/note/ship
NDAR_V02_1479,Kings Fisher,TAGU'S REQUISITIONS FOR STORES KINGS FISHER James Town 14th November 17,Kings Fisher,Kings fisher,dl,/TaggedPDF-doc/div/doc[1479]/dl/ship
NDAR_V02_1479,Kingsfisher,r at Halifax ー Boston KINGSFISHER James Town Virginia 14 Novr 1775,Kingsfisher,Kingsfisher,p3,/TaggedPDF-doc/div/doc[1479]/p3[1]/ship
NDAR_V02_1479,Kingsfisher,r at Halifax ー Boston KINGSFISHER James Town Virginia 14 Novr 1775,Kingsfisher,Kingsfisher,p2,/TaggedPDF-doc/div/doc[1479]/p2[3]/ship
