DOC_ID,CANONICAL,CONTEXT,FORMATTED,VERBATIM,CONTAINING_ELEMENT,PATH_TO_ELEMENT
NDAR_V05_1542,Pigot,"that a Mathew Walker, belonging to the PIGOT Hospital Ship, and a Pensioner to the C",Pigot,Pigot,p2,/TaggedPDF-doc/doc[1542]/docBody/p2/ship
NDAR_V05_1542,Harcourt (Transport),"I beg leave to acquaint you, that the HARCOURT Transport Under my direction, having ha",Harcourt,Harcourt,p,/TaggedPDF-doc/doc[1542]/docBody/p[4]/ship[1]
NDAR_V05_1542,Prince of Piedmont,"s received little, or no damage And the PRINCE OF PIEDMONT , and Friends Adventure, Army Victualler",Prince of Piedmont,Prince of Piedmont,p,/TaggedPDF-doc/doc[1542]/docBody/p[4]/ship[2]
NDAR_V05_1542,Prince of Piedmont,"s received little, or no damage And the PRINCE OF PIEDMONT , and Friends Adventure, Army Victualler",Prince of Piedmont,Prince of Piedmont,p,/TaggedPDF-doc/doc[1542]/docBody/p[4]/ship[3]
NDAR_V05_1542,Friends Adventure,"damage And the Prince of Piedmont, and FRIENDS ADVENTURE , Army Victuallers, are totally Lost; th",Friends Adventure,Friends Adventure,p,/TaggedPDF-doc/doc[1542]/docBody/p[4]/ship[4]
NDAR_V05_1543,Bristol (Ship),"OFFICER ON BOARD HIS MAJESTY'S SHIP THE BRISTOL , NEAR CHARLESTOWN, SOUTH CAROLINA, DATE",Bristol,BRISTOL,aut,/TaggedPDF-doc/doc[1543]/title/aut/ship
NDAR_V05_1543,Experiment,"t was. We fell down in company with the EXPERIMENT , of 50 guns, the Solebay and Active fri",Experiment,Experiment,p,/TaggedPDF-doc/doc[1543]/docBody/p[1]/ship[1]
NDAR_V05_1543,Solebay,"ny with the Experiment, of 50 guns, the SOLEBAY and Active frigates of 28 guns each. As",Solebay,Solebay,p,/TaggedPDF-doc/doc[1543]/docBody/p[1]/ship[2]
NDAR_V05_1543,Active (Frigate),"Experiment, of 50 guns, the Solebay and ACTIVE frigates of 28 guns each. As soon as we",Active,Active,p,/TaggedPDF-doc/doc[1543]/docBody/p[1]/ship[3]
NDAR_V05_1543,Experiment,"t was. We fell down in company with the EXPERIMENT , of 50 guns, the Solebay and Active fri",Experiment,Experiment,p,/TaggedPDF-doc/doc[1543]/docBody/p[1]/ship[4]
NDAR_V05_1543,Active (Frigate),"Experiment, of 50 guns, the Solebay and ACTIVE frigates of 28 guns each. As soon as we",Active,Active,p,/TaggedPDF-doc/doc[1543]/docBody/p[1]/ship[5]
NDAR_V05_1543,Solebay,"ny with the Experiment, of 50 guns, the SOLEBAY and Active frigates of 28 guns each. As",Solebay,Solebay,p,/TaggedPDF-doc/doc[1543]/docBody/p[1]/ship[6]
NDAR_V05_1543,Experiment,"t was. We fell down in company with the EXPERIMENT , of 50 guns, the Solebay and Active fri",Experiment,Experiment,p,/TaggedPDF-doc/doc[1543]/docBody/p[1]/ship[7]
NDAR_V05_1544,Eagle,", on the 23d following Lord Howe in the EAGLE called off the harbour but tarried only",Eagle,Eagle,p,/TaggedPDF-doc/doc[1544]/docBody/p/ship[1]
NDAR_V05_1544,Renown (Sloop),the 5th under convoy of two Sloops. The RENOWN likewise sailed two days before with 15,Renown,Renown,p,/TaggedPDF-doc/doc[1544]/docBody/p/ship[2]
NDAR_V05_1545,Lord Howe,"of the captures of the ships named the LORD HOWE , George, Anne, & Lady Juliana, & the br",Lord Howe,Lord Howe,p,/TaggedPDF-doc/doc[1545]/docBody/p[5]/ship[1]
NDAR_V05_1545,George,"tures of the ships named the Lord Howe, GEORGE , Anne, & Lady Juliana, & the brig named",George,George,p,/TaggedPDF-doc/doc[1545]/docBody/p[5]/ship[2]
NDAR_V05_1545,Anne,"the ships named the Lord Howe, George, ANNE , & Lady Juliana, & the brig named the A",Anne,Anne,p,/TaggedPDF-doc/doc[1545]/docBody/p[5]/ship[3]
NDAR_V05_1545,Lady Juliana,"ps named the Lord Howe, George, Anne, & LADY JULIANA , & the brig named the Annabella; & the",Lady Juliana,Lady Juliana,p,/TaggedPDF-doc/doc[1545]/docBody/p[5]/ship[4]
NDAR_V05_1545,Annabella,"e, & Lady Juliana, & the brig named the ANNABELLA ; & the Judge of said Court has in his p",Annabella,Annabella,p,/TaggedPDF-doc/doc[1545]/docBody/p[5]/ship[5]
NDAR_V05_1546,Creighton (Ship),"Adams Papers, MassHS. 2. The ship CREIGHTON and the ship Zachariah Bayley, taken by",Creighton,Creighton,note,/TaggedPDF-doc/doc[1546]/note/ship[1]
NDAR_V05_1546,Zachariah Bayley (Ship),"2. The ship Creighton and the ship ZACHARIAH BAYLEY , taken by the Massachusetts privateer s",Zachariah Bayley,Zachariah Bayley,note,/TaggedPDF-doc/doc[1546]/note/ship[2]
NDAR_V05_1546,Yankee (Sloop),"en by the Massachusetts privateer sloop YANKEE , Henry Johnson, commander.",Yankee,Yankee,note,/TaggedPDF-doc/doc[1546]/note/ship[3]
NDAR_V05_1547,Yankee (Sloop),"2. The Massachusetts privateer sloop YANKEE , of 9 guns and 60 men; the prizes being",Yankee,Yankee,note,/TaggedPDF-doc/doc[1547]/note/ship[1]
NDAR_V05_1547,Zachariah Bayley (Ship),"s and 60 men; the prizes being the ship ZACHARIAH BAYLEY , of 300 tons burden, and the ship Creig",Zachariah Bayley,Zachariah Bayley,note,/TaggedPDF-doc/doc[1547]/note/ship[2]
NDAR_V05_1547,Creighton (Ship),"ayley, of 300 tons burden, and the ship CREIGHTON , of about 200 tons; Mass. Arch., vol. 7",Creighton,Creighton,note,/TaggedPDF-doc/doc[1547]/note/ship[3]
NDAR_V05_1548,George (Ship),t my counsel affirms that half the ship GEORGE and brig Annabella will be adjudged to,George,George,p,/TaggedPDF-doc/doc[1548]/docBody/p[2]/ship[1]
NDAR_V05_1548,Annabella (Brig),irms that half the ship George and brig ANNABELLA will be adjudged to the Colony briganti,Annabella,Annabella,p,/TaggedPDF-doc/doc[1548]/docBody/p[2]/ship[2]
NDAR_V05_1548,Annabella (Brig),irms that half the ship George and brig ANNABELLA will be adjudged to the Colony briganti,Annabella,Annabella,p,/TaggedPDF-doc/doc[1548]/docBody/p[4]/ship
NDAR_V05_1549,Providence,INENTAL FRIGATES IN RHODE ISLAND [ PROVIDENCE ] July 8th Voted that Mr John Brow,Providence,Providence,p,/TaggedPDF-doc/doc[1549]/docBody/p[2]/ship
NDAR_V05_1549,Warren,an be Appointed Chief Mate on Board the WARREN if he Signs the Articles tomorrow Morni,Warren,Warren,p,/TaggedPDF-doc/doc[1549]/docBody/p[5]/ship
NDAR_V05_1549,Warren,an be Appointed Chief Mate on Board the WARREN if he Signs the Articles tomorrow Morni,Warren,Warren,p,/TaggedPDF-doc/doc[1549]/docBody/p[8]/ship
NDAR_V05_1549,Providence,INENTAL FRIGATES IN RHODE ISLAND [ PROVIDENCE ] July 8th Voted that Mr John Brow,Providence,Providence,p,/TaggedPDF-doc/doc[1549]/docBody/p[10]/ship
NDAR_V05_1549,Warren,an be Appointed Chief Mate on Board the WARREN if he Signs the Articles tomorrow Morni,Warren,Warren,p,/TaggedPDF-doc/doc[1549]/docBody/p[11]/ship
NDAR_V05_1550,Shark (Galley),ACCOUNT AGAINST THE CONNECTICUT GALLEY SHARK BEFORE HER DEPARTURE FOR NEW YORK,Shark,SHARK,title,/TaggedPDF-doc/doc[1550]/title/ship
NDAR_V05_1551,Eagle,"we have accounts that he sail'd in the EAGLE Man of war some time since, but no acco",Eagle,Eagle,p2,/TaggedPDF-doc/doc[1551]/docBody/p2/ship
NDAR_V05_1552,Genl Wolfe (Sloop),"rter Master General, on Board the Sloop GENL WOLFE Andrew Do[w]ne Master, and to be delive",Genl Wolfe,Genl Wolfe,p,/TaggedPDF-doc/doc[1552]/docBody/p[1]/ship
NDAR_V05_1553,Asia,"on the East Side of Staten-Island. The ASIA brought up the Rear of the Fleet, and i",Asia,Asia,p,/TaggedPDF-doc/doc[1553]/docBody/p[1]/ship
NDAR_V05_1553,Killingsworth (Transport),"rth.Yesterday 7 Seamen belonging to the KILLINGSWORTH Transport, of 700 Tons, was Brought to",Killingsworth,Killingsworth,p,/TaggedPDF-doc/doc[1553]/docBody/p[8]/ship
NDAR_V05_1554,Amity's Admonition,"y 8th, 1776, deserted from on board the AMITY'S ADMONITION , commanded by Captain John Noles, (it b",Amity's Admonition,Amity's Admonition,p,/TaggedPDF-doc/doc[1554]/docBody/p[1]/ship[1]
NDAR_V05_1554,Macaroni (Sloop),"st he was taken a prisoner in the sloop MACARONI , commanded by Captain John Arthur, belo",Macaroni,Macaroni,p,/TaggedPDF-doc/doc[1554]/docBody/p[1]/ship[2]
NDAR_V05_1554,Cerberus,"the frigate which took him, called the CERBERUS . In the fleet in our harbour now are th",Cerberus,Cerberus,p,/TaggedPDF-doc/doc[1554]/docBody/p[1]/ship[3]
NDAR_V05_1554,Asia,"In the fleet in our harbour now are the ASIA , two ships of fifty and one of forty gu",Asia,Asia,p,/TaggedPDF-doc/doc[1554]/docBody/p[1]/ship[4]
NDAR_V05_1554,Greyhound (Frigate),"ips of fifty and one of forty guns; the GREYHOUND frigate; two sloops, commanded by [Jame",Greyhound,Greyhound,p,/TaggedPDF-doc/doc[1554]/docBody/p[1]/ship[5]
NDAR_V05_1555,Chatham,YNEUX SHULDHAM TO PHILIP STEPHENS CHATHAM off Staten Island near New York the 8th,Chatham,Chatham,dl,/TaggedPDF-doc/doc[1555]/dl/ship
NDAR_V05_1555,Phoenix,e given Orders to Captain Parker of the PHOENIX taking the Rose under his Command to pr,Phoenix,Phoenix,p,/TaggedPDF-doc/doc[1555]/docBody/p[2]/ship[1]
NDAR_V05_1555,Rose,aptain Parker of the Phoenix taking the ROSE under his Command to proceed the first,Rose,Rose,p,/TaggedPDF-doc/doc[1555]/docBody/p[2]/ship[2]
NDAR_V05_1555,Chatham,YNEUX SHULDHAM TO PHILIP STEPHENS CHATHAM off Staten Island near New York the 8th,Chatham,Chatham,p,/TaggedPDF-doc/doc[1555]/docBody/p[2]/ship[3]
NDAR_V05_1555,Asia,"our future Operations only the Chatham, ASIA , Centurion and Greyhound Frigate, which",Asia,Asia,p,/TaggedPDF-doc/doc[1555]/docBody/p[2]/ship[4]
NDAR_V05_1555,Centurion,"ture Operations only the Chatham, Asia, CENTURION and Greyhound Frigate, which I hope wil",Centurion,Centurion,p,/TaggedPDF-doc/doc[1555]/docBody/p[2]/ship[5]
NDAR_V05_1555,Greyhound (Frigate),"s only the Chatham, Asia, Centurion and GREYHOUND Frigate, which I hope will be sufficien",Greyhound,Greyhound,p,/TaggedPDF-doc/doc[1555]/docBody/p[2]/ship[6]
NDAR_V05_1555,Cerberus (Ship),ain [John] Symons of His Majesty's Ship CERBERUS whom I joined in my passage to this pla,Cerberus,Cerberus,p,/TaggedPDF-doc/doc[1555]/docBody/p[3]/ship[1]
NDAR_V05_1555,Flora,"lace, that four Transports, part of the FLORA 's Convoy (two of them the Crawford and",Flora,Flora,p,/TaggedPDF-doc/doc[1555]/docBody/p[3]/ship[2]
NDAR_V05_1555,Crawford,"of the Flora's Convoy (two of them the CRAWFORD and Oxford,) have been taken in their p",Crawford,Crawford,p,/TaggedPDF-doc/doc[1555]/docBody/p[3]/ship[3]
NDAR_V05_1555,Oxford,"'s Convoy (two of them the Crawford and OXFORD ,) have been taken in their passage by t",Oxford,Oxford,p,/TaggedPDF-doc/doc[1555]/docBody/p[3]/ship[4]
NDAR_V05_1555,Glasgow,"of the Rebel Vessels which attack'd the GLASGOW , and as an Account of that Action is me",Glasgow,Glasgow,p,/TaggedPDF-doc/doc[1555]/docBody/p[3]/ship[5]
NDAR_V05_1555,Mercury (Ship),nd your information.2His Majesty's Ship MERCURY with Dispatches for General Howe and me,Mercury,Mercury,p,/TaggedPDF-doc/doc[1555]/docBody/p[4]/ship[1]
NDAR_V05_1555,Phoenix,e given Orders to Captain Parker of the PHOENIX taking the Rose under his Command to pr,Phoenix,Phoenix,p,/TaggedPDF-doc/doc[1555]/docBody/p[4]/ship[2]
NDAR_V05_1555,Mercury (Ship),nd your information.2His Majesty's Ship MERCURY with Dispatches for General Howe and me,Mercury,Mercury,p,/TaggedPDF-doc/doc[1555]/docBody/p[4]/ship[3]
NDAR_V05_1555,Bristol,"Captain Montagu in the Mercury left the BRISTOL the 21st May, at Cape Fear, and was the",Bristol,Bristol,p,/TaggedPDF-doc/doc[1555]/docBody/p[4]/ship[4]
NDAR_V05_1555,Tamer,"ing Halifax for want of Forage, and the TAMER being hourly expected from the Bay of F",Tamer,Tamer,p,/TaggedPDF-doc/doc[1555]/docBody/p[5]/ship[1]
NDAR_V05_1555,Niger,"directed Captain [George] Talbot of the NIGER to continue at Halifax, and with the Ta",Niger,Niger,p,/TaggedPDF-doc/doc[1555]/docBody/p[5]/ship[2]
NDAR_V05_1555,Tamer,"ing Halifax for want of Forage, and the TAMER being hourly expected from the Bay of F",Tamer,Tamer,p,/TaggedPDF-doc/doc[1555]/docBody/p[5]/ship[3]
NDAR_V05_1555,Savage,place I daily expect their Arrival.The SAVAGE which I left refitting as soon as she i,Savage,Savage,p,/TaggedPDF-doc/doc[1555]/docBody/p[6]/ship
NDAR_V05_1555,Andrew Doria (Brig),"t James Josiah, of the Continental brig ANDREW DORIA .",Andrew Doria,Andrew Doria,note,/TaggedPDF-doc/doc[1555]/note/ship
NDAR_V05_1556,Hartfield (Transport),T HENRY CHADDS TO PHILIP STEPHENS HARTFIELD Transport Staten Island July the 8th 17,Hartfield,Hartfield,dl,/TaggedPDF-doc/doc[1556]/dl/ship
NDAR_V05_1556,Hartfield (Transport),T HENRY CHADDS TO PHILIP STEPHENS HARTFIELD Transport Staten Island July the 8th 17,Hartfield,Hartfield,p,/TaggedPDF-doc/doc[1556]/postscript/p[1]/ship
NDAR_V05_1556,William and Mary,nsports Named in the Margin] Hartfield WILLIAM & MARY Good Intent Spy Argo Three Sisters,William & Mary,William & Mary,p,/TaggedPDF-doc/doc[1556]/postscript/p[2]/ship
NDAR_V05_1556,Good Intent,the Margin] Hartfield William & Mary GOOD INTENT Spy Argo Three Sisters Resolution,Good Intent,Good Intent,p,/TaggedPDF-doc/doc[1556]/postscript/p[3]/ship
NDAR_V05_1556,Spy,Hartfield William & Mary Good Intent SPY Argo Three Sisters Resolution Willi,Spy,Spy,p,/TaggedPDF-doc/doc[1556]/postscript/p[4]/ship
NDAR_V05_1556,Argo,ield William & Mary Good Intent Spy ARGO Three Sisters Resolution William Roy,Argo,Argo,p,/TaggedPDF-doc/doc[1556]/postscript/p[5]/ship
NDAR_V05_1556,Three Sisters,"William & Mary Good Intent Spy Argo THREE SISTERS Resolution William Royal George,",Three Sisters,Three Sisters,p,/TaggedPDF-doc/doc[1556]/postscript/p[6]/ship
NDAR_V05_1556,Resolution,"Good Intent Spy Argo Three Sisters RESOLUTION William Royal George,",Resolution,Resolution,p,/TaggedPDF-doc/doc[1556]/postscript/p[7]/ship
NDAR_V05_1556,William,nsports Named in the Margin] Hartfield WILLIAM & Mary Good Intent Spy Argo Three S,William,William,p,/TaggedPDF-doc/doc[1556]/postscript/p[8]/ship
NDAR_V05_1556,Royal George,"rgo Three Sisters Resolution William ROYAL GEORGE ,",Royal George,Royal George,p,/TaggedPDF-doc/doc[1556]/postscript/p[9]/ship
NDAR_V05_1557,Swan (Sloop),HOMAS MOFFAT [On board H.M. Sloop SWAN at Sandy Hook] July 8th [1776] Th,Swan,Swan,dl,/TaggedPDF-doc/doc[1557]/dl/ship
NDAR_V05_1557,Swan (Sloop),HOMAS MOFFAT [On board H.M. Sloop SWAN at Sandy Hook] July 8th [1776] Th,Swan,Swan,p,/TaggedPDF-doc/doc[1557]/docBody/p/ship[1]
NDAR_V05_1557,Mercury,d joind the Kings Army. Dind aboard the MERCURY pacquett. 1. Thomas Moffat's Diar,Mercury,Mercury,p,/TaggedPDF-doc/doc[1557]/docBody/p/ship[2]
NDAR_V05_1563,Nancy (Brig),cles saved by Ellias Hughes out of Brig NANCY which I have had apprised but having no,Nancy,Nancy,p,/TaggedPDF-doc/doc[1563]/docBody/p[1]/ship[1]
NDAR_V05_1563,Wasp,"t Cross the Country to put on Board the WASP , which you'll Please to direct how I am",Wasp,Wasp,p,/TaggedPDF-doc/doc[1563]/docBody/p[1]/ship[2]
NDAR_V05_1563,Nancy (Brig),cles saved by Ellias Hughes out of Brig NANCY which I have had apprised but having no,Nancy,Nancy,p,/TaggedPDF-doc/doc[1563]/docBody/p[2]/ship
NDAR_V05_1563,Hornet (Sloop),2. Captain of the Continental sloop HORNET .,Hornet,Hornet,note,/TaggedPDF-doc/doc[1563]/note/ship
NDAR_V05_1566,Nautilus (Sloop),icate of which is herewith annexed) The NAUTILUS Sloop of war arrived from the Northward,Nautilus,Nautilus,p,/TaggedPDF-doc/doc[1566]/docBody/p[1]/ship[1]
NDAR_V05_1566,Glasgow,"ur months before, his dispatches by the GLASGOW man of war having been thrown overboard",Glasgow,Glasgow,p,/TaggedPDF-doc/doc[1566]/docBody/p[1]/ship[2]
NDAR_V05_1566,Ranger (Sloop),gues of Charles Town were joined by the RANGER Sloop of war with the remainder of the,Ranger,Ranger,p,/TaggedPDF-doc/doc[1566]/docBody/p[4]/ship
NDAR_V05_1567,Bristol,R GENERAL HENRY CLINTON Sir BRISTOL in Five Fathom Hole 8th July 1776 off C,Bristol,Bristol,dl,/TaggedPDF-doc/doc[1567]/dl/ship
NDAR_V05_1568,Argo (Ship),1776 Sir His Majesty's Ship ARGO (whereof I am Purser) being Ordered to,Argo,Argo,p,/TaggedPDF-doc/doc[1568]/docBody/p/ship[1]
NDAR_V05_1568,Argo (Ship),1776 Sir His Majesty's Ship ARGO (whereof I am Purser) being Ordered to,Argo,Argo,p,/TaggedPDF-doc/doc[1568]/docBody/p/ship[2]
NDAR_V05_1569,Viper (Sloop),"atturday Last came into our Harbour the VIPER Sloop of War, & She has taken five fish",Viper,Viper,p,/TaggedPDF-doc/doc[1569]/docBody/p/ship[1]
NDAR_V05_1569,Marlin (Ship),is Royal with her prizes where the Ship MARLIN of Eighteen Guns Lyes. there to fix out,Marlin,Marlin,p,/TaggedPDF-doc/doc[1569]/docBody/p/ship[2]
NDAR_V05_1569,Viper (Sloop),"atturday Last came into our Harbour the VIPER Sloop of War, & She has taken five fish",Viper,Viper,p,/TaggedPDF-doc/doc[1569]/docBody/p/ship[3]
NDAR_V05_1569,Viper (Sloop),"atturday Last came into our Harbour the VIPER Sloop of War, & She has taken five fish",Viper,Viper,p,/TaggedPDF-doc/doc[1569]/docBody/p/ship[4]
NDAR_V05_1569,Viper (Sloop),"atturday Last came into our Harbour the VIPER Sloop of War, & She has taken five fish",Viper,Viper,p,/TaggedPDF-doc/doc[1569]/docBody/p/ship[5]
NDAR_V05_1570,Diligent (Schooner),by Mr [Richard] Derby for the Schooner DILIGENT Duncan Campbell Master & Owner be a for,Diligent,Diligent,p2,/TaggedPDF-doc/doc[1570]/docBody/p2[1]/ship
NDAR_V05_1570,Delight (Schooner),husetts Bay Mariner ー That the Schooner DELIGHT Whereof the said Duncan Campbell is at,Delight,Delight,p2,/TaggedPDF-doc/doc[1570]/docBody/p2[2]/ship
NDAR_V05_1570,Warren,"pence, fitted an Armed Sloop Call'd the WARREN for the purpose of making reprisals on",Warren,Warren,p,/TaggedPDF-doc/doc[1570]/docBody/p[2]/ship
NDAR_V05_1570,Tyrannicide (Sloop),Capt. John Fisk Commander of the Sloop TYRANNICIDE ViztThe Sloop,Tyrannicide,Tyrannicide,p2,/TaggedPDF-doc/doc[1570]/docBody/p2[5]/ship
NDAR_V05_1570,Tyrannicide (Sloop),Capt. John Fisk Commander of the Sloop TYRANNICIDE ViztThe Sloop,Tyrannicide,Tyrannicide,p,/TaggedPDF-doc/doc[1570]/docBody/p[4]/ship
NDAR_V05_1570,Diligent (Schooner),by Mr [Richard] Derby for the Schooner DILIGENT Duncan Campbell Master & Owner be a for,Diligent,Diligent,note,/TaggedPDF-doc/doc[1570]/note[1]/ship[1]
NDAR_V05_1570,Delight (Schooner),husetts Bay Mariner ー That the Schooner DELIGHT Whereof the said Duncan Campbell is at,Delight,Delight,note,/TaggedPDF-doc/doc[1570]/note[1]/ship[2]
NDAR_V05_1571,Spy (Schooner),"s of his crew &c. on board the schooner SPY . 1. Hoadly, ed., Connecticut Reco",Spy,Spy,p,/TaggedPDF-doc/doc[1571]/docBody/p/ship
NDAR_V05_1575,Phoenix,"nd July we passed them, convoyed by the PHOENIX , Rose, and Greyhound Men of War. Fortun",Phoenix,Phoenix,p2,/TaggedPDF-doc/doc[1575]/docBody/p2[5]/ship[1]
NDAR_V05_1575,Rose,"e passed them, convoyed by the Phoenix, ROSE , and Greyhound Men of War. Fortunately",Rose,Rose,p2,/TaggedPDF-doc/doc[1575]/docBody/p2[5]/ship[2]
NDAR_V05_1575,Greyhound,"hem, convoyed by the Phoenix, Rose, and GREYHOUND Men of War. Fortunately we were deceive",Greyhound,Greyhound,p2,/TaggedPDF-doc/doc[1575]/docBody/p2[5]/ship[3]
NDAR_V05_1577,General Putnam (Schooner),"een shillings, on account your schooner GENERAL PUTNAM , for which I have given a bill payable",General Putnam,General Putnam,p,/TaggedPDF-doc/doc[1577]/docBody/p[1]/ship
NDAR_V05_1580,Fly,o Hoysteed Hacker Esqr Commander of the FLY at Brunswick or Amboy.,Fly,Fly,p2,/TaggedPDF-doc/doc[1580]/docBody/p2/ship
NDAR_V05_1581,Polly,etitioner late Master of the Brigintine POLLY from Hunduras loaded with Logwood & Mah,Polly,Polly,p,/TaggedPDF-doc/doc[1581]/docBody/p[2]/ship[1]
NDAR_V05_1581,Lively,"April near the Capes of Delawar, by the LIVELY Privateer Schooner fitted out by Lord D",Lively,Lively,p,/TaggedPDF-doc/doc[1581]/docBody/p[2]/ship[2]
NDAR_V05_1581,King of Prussia,"Commanding the Letter of Marque-Ship ー KING OF PRUSSIA belonging to this place, when attacked",King of Prussia,King of Prussia,p2,/TaggedPDF-doc/doc[1581]/docBody/p2[1]/ship
NDAR_V05_1582,Juno (Ship),"ADVERTISEMENT OF SALE OF THE PRIZE SHIP JUNO On Thursday, the 24th instant Jul",Juno,JUNO,title,/TaggedPDF-doc/doc[1582]/title/ship
NDAR_V05_1582,Juno (Ship),"o'Clock in the Evening, the Prize Ship JUNO , with all her Boats, Tackle and Furnitu",Juno,Juno,p,/TaggedPDF-doc/doc[1582]/docBody/p/ship
NDAR_V05_1582,Chance,nsylvania privateer sloops Congress and CHANCE .,Chance,Chance,note,/TaggedPDF-doc/doc[1582]/note/ship
NDAR_V05_1585,Defence,"nders hail each other, and say that the DEFENCE was laying off Hoopers Island, and that",Defence,Defence,p2,/TaggedPDF-doc/doc[1585]/docBody/p2[1]/ship
NDAR_V05_1586,Roebuck,"JOURNAL OF H.M.S. ROEBUCK , CAPTAIN ANDREW SNAPE HAMOND July",Roebuck,ROEBUCK,title,/TaggedPDF-doc/doc[1586]/title/ship
NDAR_V05_1586,Fowey,Monday 8that 6 in the morning the FOWEY weighed by order to protect the entranc,Fowey,Fowey,p2,/TaggedPDF-doc/doc[1586]/docBody/p2[2]/ship
NDAR_V05_1586,Dunmore,"eet, and kept up a constant fire on the DUNMORE , manned all the Boats and sent them to",Dunmore,Dunmore,p2,/TaggedPDF-doc/doc[1586]/docBody/p2[5]/ship
NDAR_V05_1587,Otter (Sloop),"JOURNAL OF H.M. SLOOP OTTER , CAPTAIN MATTHEW SQUIRE July [177",Otter,OTTER,title,/TaggedPDF-doc/doc[1587]/title/ship
NDAR_V05_1587,Dunmore,"els opened a Battery of two Guns on the DUNMORE , by which two of our Men were wounded o",Dunmore,Dunmore,p2,/TaggedPDF-doc/doc[1587]/docBody/p2[3]/ship
NDAR_V05_1588,Bristol,RKER TO PHILIP STEPHENS Sir BRISTOL in Five-Fathom Hole within Charles Town,Bristol,Bristol,dl,/TaggedPDF-doc/doc[1588]/dl/ship
NDAR_V05_1588,Sphynx,Proceedings to that Date ー The 26th the SPHYNX and Pensacola Packet returned from Reco,Sphynx,Sphynx,p,/TaggedPDF-doc/doc[1588]/docBody/p[1]/ship[1]
NDAR_V05_1588,Pensacola Packet,to that Date ー The 26th the Sphynx and PENSACOLA PACKET returned from Reconnoitring and making,Pensacola Packet,Pensacola Packet,p,/TaggedPDF-doc/doc[1588]/docBody/p[1]/ship[2]
NDAR_V05_1588,Sphynx,Proceedings to that Date ー The 26th the SPHYNX and Pensacola Packet returned from Reco,Sphynx,Sphynx,p,/TaggedPDF-doc/doc[1588]/docBody/p[1]/ship[3]
NDAR_V05_1588,Comet,and a Pirate Brig of 18 Guns called the COMET ; the Brig got over Charles-Town-Bar and,Comet,Comet,p,/TaggedPDF-doc/doc[1588]/docBody/p[1]/ship[4]
NDAR_V05_1588,Sphynx,Proceedings to that Date ー The 26th the SPHYNX and Pensacola Packet returned from Reco,Sphynx,Sphynx,p,/TaggedPDF-doc/doc[1588]/docBody/p[1]/ship[5]
NDAR_V05_1588,Sphynx,Proceedings to that Date ー The 26th the SPHYNX and Pensacola Packet returned from Reco,Sphynx,Sphynx,p,/TaggedPDF-doc/doc[1588]/docBody/p[1]/ship[6]
NDAR_V05_1588,Delegate,and that Night sent the Sphynx and the DELEGATE (a Boat belonging to the General) to lo,Delegate,Delegate,p,/TaggedPDF-doc/doc[1588]/docBody/p[1]/ship[7]
NDAR_V05_1588,Ranger,"next Morning we Sailed, and joined the RANGER with Her Convoy, which complete the who",Ranger,Ranger,p,/TaggedPDF-doc/doc[1588]/docBody/p[2]/ship[1]
NDAR_V05_1588,Ranger,"next Morning we Sailed, and joined the RANGER with Her Convoy, which complete the who",Ranger,Ranger,p,/TaggedPDF-doc/doc[1588]/docBody/p[2]/ship[2]
NDAR_V05_1588,Sphynx,Proceedings to that Date ー The 26th the SPHYNX and Pensacola Packet returned from Reco,Sphynx,Sphynx,p,/TaggedPDF-doc/doc[1588]/docBody/p[2]/ship[3]
NDAR_V05_1588,St Lawrence (Schooner),"les-Town-Bar. that Night the Sphynx and ST LAWRENCE Schooner, and next Morning the Active w",St Lawrence,St Lawrence,p,/TaggedPDF-doc/doc[1588]/docBody/p[2]/ship[4]
NDAR_V05_1588,Active,"Lawrence Schooner, and next Morning the ACTIVE were sent off the Bar, to make observat",Active,Active,p,/TaggedPDF-doc/doc[1588]/docBody/p[2]/ship[5]
NDAR_V05_1588,Ranger,"next Morning we Sailed, and joined the RANGER with Her Convoy, which complete the who",Ranger,Ranger,p,/TaggedPDF-doc/doc[1588]/docBody/p[2]/ship[6]
NDAR_V05_1588,Delegate,and that Night sent the Sphynx and the DELEGATE (a Boat belonging to the General) to lo,Delegate,Delegate,p,/TaggedPDF-doc/doc[1588]/docBody/p[2]/ship[7]
NDAR_V05_1588,Friendship,"vantages might be drawn from Arming the FRIENDSHIP , and having full Authority from the Lor",Friendship,Friendship,p,/TaggedPDF-doc/doc[1588]/docBody/p[2]/ship[8]
NDAR_V05_1588,Bristol,RKER TO PHILIP STEPHENS Sir BRISTOL in Five-Fathom Hole within Charles Town,Bristol,Bristol,p,/TaggedPDF-doc/doc[1588]/docBody/p[2]/ship[9]
NDAR_V05_1588,Ranger,"next Morning we Sailed, and joined the RANGER with Her Convoy, which complete the who",Ranger,Ranger,p,/TaggedPDF-doc/doc[1588]/docBody/p[2]/ship[10]
NDAR_V05_1588,Delegate,and that Night sent the Sphynx and the DELEGATE (a Boat belonging to the General) to lo,Delegate,Delegate,p,/TaggedPDF-doc/doc[1588]/docBody/p[2]/ship[11]
NDAR_V05_1588,Friendship,"vantages might be drawn from Arming the FRIENDSHIP , and having full Authority from the Lor",Friendship,Friendship,p,/TaggedPDF-doc/doc[1588]/docBody/p[2]/ship[12]
NDAR_V05_1588,St Lawrence (Schooner),"les-Town-Bar. that Night the Sphynx and ST LAWRENCE Schooner, and next Morning the Active w",St Lawrence,St Lawrence,p,/TaggedPDF-doc/doc[1588]/docBody/p[2]/ship[13]
NDAR_V05_1588,Ranger,"next Morning we Sailed, and joined the RANGER with Her Convoy, which complete the who",Ranger,Ranger,p,/TaggedPDF-doc/doc[1588]/docBody/p[2]/ship[14]
NDAR_V05_1588,Friendship,"vantages might be drawn from Arming the FRIENDSHIP , and having full Authority from the Lor",Friendship,Friendship,p,/TaggedPDF-doc/doc[1588]/docBody/p[2]/ship[15]
NDAR_V05_1588,Ranger,"next Morning we Sailed, and joined the RANGER with Her Convoy, which complete the who",Ranger,Ranger,p,/TaggedPDF-doc/doc[1588]/docBody/p[2]/ship[16]
NDAR_V05_1588,St Lawrence (Schooner),"les-Town-Bar. that Night the Sphynx and ST LAWRENCE Schooner, and next Morning the Active w",St Lawrence,St Lawrence,p,/TaggedPDF-doc/doc[1588]/docBody/p[2]/ship[17]
NDAR_V05_1588,Friendship,"vantages might be drawn from Arming the FRIENDSHIP , and having full Authority from the Lor",Friendship,Friendship,p,/TaggedPDF-doc/doc[1588]/docBody/p[2]/ship[18]
NDAR_V05_1588,Bristol,RKER TO PHILIP STEPHENS Sir BRISTOL in Five-Fathom Hole within Charles Town,Bristol,Bristol,p,/TaggedPDF-doc/doc[1588]/docBody/p[2]/ship[19]
NDAR_V05_1588,Bristol,RKER TO PHILIP STEPHENS Sir BRISTOL in Five-Fathom Hole within Charles Town,Bristol,Bristol,p,/TaggedPDF-doc/doc[1588]/docBody/p[2]/ship[20]
NDAR_V05_1588,Prince of Piedmont,"rts got over into five Fathom Hole, the PRINCE OF PIEDMONT Victualler struck fast on the Bar, and",Prince of Piedmont,Prince of Piedmont,p,/TaggedPDF-doc/doc[1588]/docBody/p[2]/ship[21]
