DOC_ID,CANONICAL,CONTEXT,FORMATTED,VERBATIM,CONTAINING_ELEMENT,PATH_TO_ELEMENT
NDAR_V05_0546,Roebuck (Ship),der my hand on board His Majesty's Ship ROEBUCK at Gwins Island in Virginia,Roebuck,Roebuck,dl2,/TaggedPDF-doc/doc[546]/dl2/ship
NDAR_V05_0547,Sovereign,LIS Major Genl On board the SOVEREIGN Saturday the 1st June 1776 Earl C,Sovereign,Sovereign,dl,/TaggedPDF-doc/doc[547]/dl/ship
NDAR_V05_0548,Bristol,ERAL HENRY CLINTON Dear Sir BRISTOL June 1st 1776 I agree entirely wi,Bristol,Bristol,dl,/TaggedPDF-doc/doc[548]/dl/ship
NDAR_V05_0548,Sphynx,ng.I intend to Dispatch immediately the SPHYNX and St Lawrence Schooner to examine the,Sphynx,Sphynx,p,/TaggedPDF-doc/doc[548]/docBody/p[2]/ship[1]
NDAR_V05_0548,St Lawrence (Schooner),"to Dispatch immediately the Sphynx and ST LAWRENCE Schooner to examine the Bar, and to End",St Lawrence,St Lawrence,p,/TaggedPDF-doc/doc[548]/docBody/p[2]/ship[2]
NDAR_V05_0549,Endeavour,"ntine to be Commissioned and called the ENDEAVOUR , and have appointed Lieutenant Francis",Endeavour,Endeavour,p,/TaggedPDF-doc/doc[549]/docBody/p[2]/ship[1]
NDAR_V05_0549,Seaford,"ted Lieutenant Francis Tinsley from the SEAFORD to Command her, and have also appointed",Seaford,Seaford,p,/TaggedPDF-doc/doc[549]/docBody/p[2]/ship[2]
NDAR_V05_0549,Seaford,"ted Lieutenant Francis Tinsley from the SEAFORD to Command her, and have also appointed",Seaford,Seaford,p,/TaggedPDF-doc/doc[549]/docBody/p[2]/ship[3]
NDAR_V05_0550,Triton,"JOURNAL OF H.M.S. TRITON , CAPTAIN SKEFFINGTON LUTWIDGE Jun",Triton,TRITON,title,/TaggedPDF-doc/doc[550]/title/ship
NDAR_V05_0551,Chatham,"PHILIP STEPHENS Duplicate. CHATHAM , In Halifax Harbour, June 2d 1776.",Chatham,Chatham,dl,/TaggedPDF-doc/doc[551]/dl/ship
NDAR_V05_0551,Canceaux,"Sir, I am to acquaint you that the CANCEAUX arrived here Yesterday and that I have",Canceaux,Canceaux,p2,/TaggedPDF-doc/doc[551]/docBody/p2[1]/ship
NDAR_V05_0551,Fowey,dged.OrdersApril 18th 1776. To send the FOWEY to Newfoundland and to deliver a Pacque,Fowey,Fowey,p2,/TaggedPDF-doc/doc[551]/docBody/p2[2]/ship
NDAR_V05_0551,Britania,"To Purchase a Ship at Boston called the BRITANIA , and to Establish her as a Sloop by the",Britania,Britania,p,/TaggedPDF-doc/doc[551]/docBody/p[1]/ship[1]
NDAR_V05_0551,Albany,"blish her as a Sloop by the Name of the ALBANY , to appoint Lieutenant [Henry] Mowat to",Albany,Albany,p,/TaggedPDF-doc/doc[551]/docBody/p[1]/ship[2]
NDAR_V05_0551,Canceaux,"Sir, I am to acquaint you that the CANCEAUX arrived here Yesterday and that I have",Canceaux,Canceaux,p,/TaggedPDF-doc/doc[551]/docBody/p[1]/ship[3]
NDAR_V05_0551,Canceaux,"Sir, I am to acquaint you that the CANCEAUX arrived here Yesterday and that I have",Canceaux,Canceaux,p,/TaggedPDF-doc/doc[551]/docBody/p[3]/ship
NDAR_V05_0551,Lady Gage (Ship),"Orders, I must inform you that the Ship LADY GAGE , which by my Letter of the 20th May, I",Lady Gage,Lady Gage,p,/TaggedPDF-doc/doc[551]/docBody/p[6]/ship[1]
NDAR_V05_0551,Britannia,u I intended to purchase in lieu of the BRITANNIA (which Ship was destroyed at Boston at,Britannia,Britannia,p,/TaggedPDF-doc/doc[551]/docBody/p[6]/ship[2]
NDAR_V05_0551,Canceaux,"Sir, I am to acquaint you that the CANCEAUX arrived here Yesterday and that I have",Canceaux,Canceaux,p,/TaggedPDF-doc/doc[551]/docBody/p[6]/ship[3]
NDAR_V05_0551,Albany,"blish her as a Sloop by the Name of the ALBANY , to appoint Lieutenant [Henry] Mowat to",Albany,Albany,p,/TaggedPDF-doc/doc[551]/docBody/p[6]/ship[4]
NDAR_V05_0551,Fowey,dged.OrdersApril 18th 1776. To send the FOWEY to Newfoundland and to deliver a Pacque,Fowey,Fowey,p,/TaggedPDF-doc/doc[551]/docBody/p[7]/ship
NDAR_V05_0551,Niger,"inted by Captain [Ceorge] Talbot of the NIGER , (which Ship arrived here Yesterday and",Niger,Niger,p,/TaggedPDF-doc/doc[551]/docBody/p[8]/ship[1]
NDAR_V05_0551,Juno,s Majesty's Affairs in Canada) that the JUNO and Blonde with the Transports under th,Juno,Juno,p,/TaggedPDF-doc/doc[551]/docBody/p[8]/ship[2]
NDAR_V05_0551,Blonde,'s Affairs in Canada) that the Juno and BLONDE with the Transports under their Convoy,Blonde,Blonde,p,/TaggedPDF-doc/doc[551]/docBody/p[8]/ship[3]
NDAR_V05_0551,Carysfort,"21st May, and that the Convoy under the CARYSFORT and Pearl were then in the Gulph.Their",Carysfort,Carysfort,p,/TaggedPDF-doc/doc[551]/docBody/p[8]/ship[4]
NDAR_V05_0551,Pearl,that the Convoy under the Carysfort and PEARL were then in the Gulph.Their Lordships,Pearl,Pearl,p,/TaggedPDF-doc/doc[551]/docBody/p[8]/ship[5]
NDAR_V05_0551,Milford,"I have been joined by no more than the MILFORD , which I cannot remove from Boston Bay,",Milford,Milford,p,/TaggedPDF-doc/doc[551]/docBody/p[11]/ship[1]
NDAR_V05_0551,Greyhound,"ch I cannot remove from Boston Bay, the GREYHOUND is now here, and which I must detain to",Greyhound,Greyhound,p,/TaggedPDF-doc/doc[551]/docBody/p[11]/ship[2]
NDAR_V05_0551,Canceaux,"Sir, I am to acquaint you that the CANCEAUX arrived here Yesterday and that I have",Canceaux,Canceaux,p,/TaggedPDF-doc/doc[551]/docBody/p[11]/ship[3]
NDAR_V05_0551,Dickinson,"1. PRO, Admiralty 1/484. 2. The DICKINSON .",Dickinson,Dickinson,note,/TaggedPDF-doc/doc[551]/note/ship
NDAR_V05_0552,Cerberus,"JOURNAL OF H.M.S. CERBERUS , CAPTAIN JOHN SYMONS [June 1776]",Cerberus,CERBERUS,title,/TaggedPDF-doc/doc[552]/title/ship
NDAR_V05_0552,Elizabeth (Brig),"RO, Admiralty 51/181. 2. The brig ELIZABETH , taken May 30, 1776. 3. Hawke, Jo",Elizabeth,Elizabeth,note,/TaggedPDF-doc/doc[552]/note[1]/ship
NDAR_V05_0552,Hawke,"Elizabeth, taken May 30, 1776. 3. HAWKE , John Clarkson, master, Newburyport for",Hawke,Hawke,note,/TaggedPDF-doc/doc[552]/note[2]/ship
NDAR_V05_0552,William,", PRO, Admiralty 1/487. 4. Ibid., WILLIAM , John Tucker, master, from St. Eustatiu",William,William,note,/TaggedPDF-doc/doc[552]/note[3]/ship[1]
NDAR_V05_0552,Elizabeth (Brig),"RO, Admiralty 51/181. 2. The brig ELIZABETH , taken May 30, 1776. 3. Hawke, Jo",Elizabeth,Elizabeth,note,/TaggedPDF-doc/doc[552]/note[3]/ship[2]
NDAR_V05_0552,Hawke,"Elizabeth, taken May 30, 1776. 3. HAWKE , John Clarkson, master, Newburyport for",Hawke,Hawke,note,/TaggedPDF-doc/doc[552]/note[3]/ship[3]
NDAR_V05_0552,William,", PRO, Admiralty 1/487. 4. Ibid., WILLIAM , John Tucker, master, from St. Eustatiu",William,William,note,/TaggedPDF-doc/doc[552]/note[3]/ship[4]
NDAR_V05_0556,Hornet,r payment ー As the men belonging to the HORNET and Wasp at the time of their arrival h,Hornet,Hornet,p,/TaggedPDF-doc/doc[556]/docBody/p/ship[1]
NDAR_V05_0556,Wasp,As the men belonging to the Hornet and WASP at the time of their arrival here have,Wasp,Wasp,p,/TaggedPDF-doc/doc[556]/docBody/p/ship[2]
NDAR_V05_0557,Otter,"We are not in Much apprehension of the OTTER or even Double Her force, but in the Co",Otter,Otter,p,/TaggedPDF-doc/doc[557]/docBody/p/ship
NDAR_V05_0558,Roebuck,", and Stood up the Bay, Attended by the ROEBUCK and two or three other Vessels, with A",Roebuck,Roebuck,p,/TaggedPDF-doc/doc[558]/docBody/p/ship
NDAR_V05_0560,Defence,"ion from Captn [James] Nicholson of the DEFENCE on a cruize down the Bay, that several",Defence,Defence,p2,/TaggedPDF-doc/doc[560]/docBody/p2/ship
NDAR_V05_0561,Roebuck,"up the bay with his Fleet joined by the ROEBUCK , and we apprehend the ships you saw off",Roebuck,Roebuck,p2,/TaggedPDF-doc/doc[561]/docBody/p2/ship
NDAR_V05_0562,Roebuck (Ship),my hand on board his Majestys Ship the ROEBUCK off Gwins Island Cheseapeak,Roebuck,Roebuck,dl2,/TaggedPDF-doc/doc[562]/dl2/ship
NDAR_V05_0562,Otter (Sloop),"Squire commander of his Majesty's Sloop OTTER 1. Hamond, Orders issued, 1776-17",Otter,Otter,p2,/TaggedPDF-doc/doc[562]/postscript/p2/ship
NDAR_V05_0563,Tamer,"only say that for near four months the TAMER a Sloop of 16 Guns, with the assistance",Tamer,Tamer,p2,/TaggedPDF-doc/doc[563]/docBody/p2[1]/ship[1]
NDAR_V05_0563,Cherokee,"of 16 Guns, with the assistance of the CHEROKEE (a Vessel that hardly deserved the name",Cherokee,Cherokee,p2,/TaggedPDF-doc/doc[563]/docBody/p2[1]/ship[2]
NDAR_V05_0564,Bristol,R GENERAL HENRY CLINTON Sir BRISTOL of[f] Bulls Bay 2nd June 1776 The,Bristol,Bristol,dl,/TaggedPDF-doc/doc[564]/dl/ship
NDAR_V05_0564,Ranger (Sloop),"of Sulivans Island, under Cover of the RANGER Sloop, the St Lawrence Schooner, and Fr",Ranger,Ranger,p,/TaggedPDF-doc/doc[564]/docBody/p[2]/ship[1]
NDAR_V05_0564,St Lawrence (Sloop),"d, under Cover of the Ranger Sloop, the ST LAWRENCE Schooner, and Friendship armed Ship; sh",St Lawrence,St Lawrence,p,/TaggedPDF-doc/doc[564]/docBody/p[2]/ship[2]
NDAR_V05_0564,Friendship,"er Sloop, the St Lawrence Schooner, and FRIENDSHIP armed Ship; shou'd This be approved, th",Friendship,Friendship,p,/TaggedPDF-doc/doc[564]/docBody/p[2]/ship[3]
NDAR_V05_0564,Bristol,R GENERAL HENRY CLINTON Sir BRISTOL of[f] Bulls Bay 2nd June 1776 The,Bristol,Bristol,p,/TaggedPDF-doc/doc[564]/docBody/p[2]/ship[4]
NDAR_V05_0564,Thunder Bomb,"the Batteries, on Sulivans Island; The THUNDER BOMB may be placed of[f] Cumin's Point and w",Thunder Bomb,Thunder Bomb,p,/TaggedPDF-doc/doc[564]/docBody/p[2]/ship[5]
NDAR_V05_0565,Sovereign,SIR PETER PARKER Commodore SOVEREIGN 2d June 1776 Sir Peter Parker Knt,Sovereign,Sovereign,dl,/TaggedPDF-doc/doc[565]/dl/ship
NDAR_V05_0566,Bristol,R GENERAL HENRY CLINTON Sir BRISTOL of[f] Bull's Island 2nd June 1776,Bristol,Bristol,dl,/TaggedPDF-doc/doc[566]/dl/ship
NDAR_V05_0566,Sphinx,e You will find considerable.I sent the SPHINX and St Lawrence Schooner last Night to,Sphinx,Sphinx,p,/TaggedPDF-doc/doc[566]/docBody/p[3]/ship[1]
NDAR_V05_0566,St Lawrence (Schooner),find considerable.I sent the Sphinx and ST LAWRENCE Schooner last Night to sound the Channe,St Lawrence,St Lawrence,p,/TaggedPDF-doc/doc[566]/docBody/p[3]/ship[2]
NDAR_V05_0566,Syren,"Shore, and this Night I shall send the SYREN for the same Purpose. The Ranger and De",Syren,Syren,p,/TaggedPDF-doc/doc[566]/docBody/p[3]/ship[3]
NDAR_V05_0566,Ranger,end the Syren for the same Purpose. The RANGER and Delegate are gone with Captain Monc,Ranger,Ranger,p,/TaggedPDF-doc/doc[566]/docBody/p[3]/ship[4]
NDAR_V05_0566,Delegate,"en for the same Purpose. The Ranger and DELEGATE are gone with Captain Moncrief, Mr Know",Delegate,Delegate,p,/TaggedPDF-doc/doc[566]/docBody/p[3]/ship[5]
NDAR_V05_0567,Hawke (Sloop),MASTER'S LOG OF H.M. SLOOP HAWKE June [1776] Carlisle bay Needhame,Hawke,HAWKE,title,/TaggedPDF-doc/doc[567]/title/ship
NDAR_V05_0567,Two Brothers (Brig),to the BaySunday 2dAM Boarded the Brigg TWO BROTHERS & took Possession of her as a Prize,Two Brothers,two Brothers,p2,/TaggedPDF-doc/doc[567]/docBody/p2[5]/ship
NDAR_V05_0568,Raleigh (Frigate),ne of the three builders of the frigate RALEIGH .,Raleigh,Raleigh,note,/TaggedPDF-doc/doc[568]/note/ship
NDAR_V05_0570,Rose,self and the three men belonging to the ROSE which were taken last April at Frenchma,Rose,Rose,p,/TaggedPDF-doc/doc[570]/docBody/p/ship
NDAR_V05_0570,Rose,self and the three men belonging to the ROSE which were taken last April at Frenchma,Rose,Rose,p3,/TaggedPDF-doc/doc[570]/postscript[1]/p3/ship
NDAR_V05_0570,Hannah (Sloop),", 372. 2. Prize crew of the sloop HANNAH ; see Captain James Wallace's orders of",Hannah,Hannah,note,/TaggedPDF-doc/doc[570]/note/ship[1]
NDAR_V05_0570,Hannah (Sloop),", 372. 2. Prize crew of the sloop HANNAH ; see Captain James Wallace's orders of",Hannah,Hannah,note,/TaggedPDF-doc/doc[570]/note/ship[2]
NDAR_V05_0571,Tyrannicide (Sloop),"econd Leuts to Serve on board the Sloop TYRANNICIDE whereof said Fisk is Captain, Read & Or",Tyrannicide,Tyrannicide,p2,/TaggedPDF-doc/doc[571]/docBody/p2/ship
NDAR_V05_0572,Britannia (Schooner),Jacob Boardman for fitting out the Schr BRITANNIA &c amounting to £14 with his Petition f,Britannia,Britannia,p,/TaggedPDF-doc/doc[572]/docBody/p[3]/ship
NDAR_V05_0573,Hope,"ed before me against the ship named the HOPE , burthen about 280 tons, commanded by A",Hope,Hope,p,/TaggedPDF-doc/doc[573]/docBody/p[2]/ship
NDAR_V05_0575,Swan,"ead, two millers, who were taken by the SWAN , Captain [James] Ayscough, as they were",Swan,Swan,p,/TaggedPDF-doc/doc[575]/docBody/p[1]/ship[1]
NDAR_V05_0575,Swan,"ead, two millers, who were taken by the SWAN , Captain [James] Ayscough, as they were",Swan,Swan,p,/TaggedPDF-doc/doc[575]/docBody/p[1]/ship[2]
NDAR_V05_0577,Betsy and Ann (Sloop),"lr Joseph Lightburn, owner of the Sloop BETSY AND ANN , Benjamin Tucker Master from Bermuda; a",Betsy and Ann,Betsy and Ann,p,/TaggedPDF-doc/doc[577]/docBody/p[1]/ship
NDAR_V05_0579,Fanny (Sloop),f Provisions Consign'd them p the Sloop FANNY Capt Britton to our Order & We have end,Fanny,Fanny,p2,/TaggedPDF-doc/doc[579]/docBody/p2/ship[1]
NDAR_V05_0579,Peggy (Sloop),"of Provisions Consign'd him p the Sloop PEGGY Capt. [Thomas] Patton, which we have al",Peggy,Peggy,p2,/TaggedPDF-doc/doc[579]/docBody/p2/ship[2]
NDAR_V05_0579,Hornet,Convoy of Capt [William] Hallock in the HORNET ; ー On the Contrary if you take up the w,Hornet,Hornet,p,/TaggedPDF-doc/doc[579]/docBody/p/ship[1]
NDAR_V05_0579,Hornet,Convoy of Capt [William] Hallock in the HORNET ; ー On the Contrary if you take up the w,Hornet,Hornet,p,/TaggedPDF-doc/doc[579]/docBody/p/ship[2]
NDAR_V05_0580,Peggy (Sloop),ady wrote you of this date by the Sloop PEGGY Capt Patton and directed how you shou'd,Peggy,Peggy,p,/TaggedPDF-doc/doc[580]/docBody/p[1]/ship
NDAR_V05_0582,Hornet,Adventures and you may Ship back by the HORNET some Packages of such Goods to the Amot,Hornet,Hornet,p,/TaggedPDF-doc/doc[582]/docBody/p[2]/ship
NDAR_V05_0583,Liverpool,"She had like to have been taken by the LIVERPOOL in this Bay, but two of the small Conti",Liverpool,Liverpool,p,/TaggedPDF-doc/doc[583]/docBody/p[3]/ship[1]
NDAR_V05_0583,Liverpool,"She had like to have been taken by the LIVERPOOL in this Bay, but two of the small Conti",Liverpool,Liverpool,p,/TaggedPDF-doc/doc[583]/docBody/p[3]/ship[2]
NDAR_V05_0585,Liverpool,"JOURNAL OF H.M.S. LIVERPOOL , CAPTAIN HENRY BELLEW June 1776 D",Liverpool,LIVERPOOL,title,/TaggedPDF-doc/doc[585]/title/ship
NDAR_V05_0589,Fowey,"R.N., TO CAPTAIN GEORGE MONTAGU, H.M.S. FOWEY Roebuck off of Gwins Isld in Virg",Fowey,FOWEY,title,/TaggedPDF-doc/doc[589]/title/ship
NDAR_V05_0589,Roebuck,"TAIN GEORGE MONTAGU, H.M.S. FOWEY ROEBUCK off of Gwins Isld in Virginia 3d June 1",Roebuck,Roebuck,dl,/TaggedPDF-doc/doc[589]/dl/ship
NDAR_V05_0589,Fowey,"Twenty one Guns is to be fired from the FOWEY , and as many from the Tenders as they c",Fowey,Fowey,p,/TaggedPDF-doc/doc[589]/docBody/p/ship[1]
NDAR_V05_0589,Roebuck,"TAIN GEORGE MONTAGU, H.M.S. FOWEY ROEBUCK off of Gwins Isld in Virginia 3d June 1",Roebuck,Roebuck,p,/TaggedPDF-doc/doc[589]/docBody/p/ship[2]
NDAR_V05_0591,Hynd (Ship),"eek arrived here his Majesty's ship the HYND , Capt. [Henry] Bryne, after having land",Hynd,Hynd,p,/TaggedPDF-doc/doc[591]/docBody/p[1]/ship
NDAR_V05_0591,Portland,"since the year 1771. It consists of the PORTLAND of 50 guns, carrying Admiral [James] Yo",Portland,Portland,p,/TaggedPDF-doc/doc[591]/docBody/p[2]/ship[1]
NDAR_V05_0591,Argo,"'s flag, Captain [Thomas] Demeresq; the ARGO of 28 guns, Captain [William] Garnier;",Argo,Argo,p,/TaggedPDF-doc/doc[591]/docBody/p[2]/ship[2]
NDAR_V05_0591,Hynd (Ship),"eek arrived here his Majesty's ship the HYND , Capt. [Henry] Bryne, after having land",Hynd,Hynd,p,/TaggedPDF-doc/doc[591]/docBody/p[2]/ship[3]
NDAR_V05_0591,Seaford,"; the Hynd of 24 guns, Capt. Bryne; the SEAFORD of 24 guns, Capt. [John] Colpoys; the P",Seaford,Seaford,p,/TaggedPDF-doc/doc[591]/docBody/p[2]/ship[4]
NDAR_V05_0591,Pomona,"d of 24 guns, Capt. [John] Colpoys; the POMONA of 18 guns, Captain Bastwood; the Hawk",Pomona,Pomona,p,/TaggedPDF-doc/doc[591]/docBody/p[2]/ship[5]
NDAR_V05_0591,Hawk,"omona of 18 guns, Captain Bastwood; the HAWK of 14 guns, Captain [Robert Palliser] C",Hawk,Hawk,p,/TaggedPDF-doc/doc[591]/docBody/p[2]/ship[6]
NDAR_V05_0591,Endeavour,", Captain [Robert Palliser] Cooper; the ENDEAVOUR armed vessel, Captain Tinsley another a",Endeavour,Endeavour,p,/TaggedPDF-doc/doc[591]/docBody/p[2]/ship[7]
NDAR_V05_0591,Sandwich (Tender),"r armed vessel to be purchased, and the SANDWICH tender, commanded by Captain Douglas. O",Sandwich,Sandwich,p,/TaggedPDF-doc/doc[591]/docBody/p[2]/ship[8]
NDAR_V05_0592,Magdalen (Schooner),"JOURNAL OF H.M. SCHOONER MAGDALEN , LIEUTENANT JOSEPH NUNN June 1776",Magdalen,MAGDALEN,title,/TaggedPDF-doc/doc[592]/title/ship
NDAR_V05_0592,John and Christopher,ith a flat Bottomed boat (recd from the JOHN & CHRISTOPHER Transpt) at 7 began to Ferry over3 Gen,John & Christopher,John & Christopher,p2,/TaggedPDF-doc/doc[592]/docBody/p2[2]/ship
NDAR_V05_0592,Magdalen,"1. PRO, Admiralty 51/4252. 2. The MAGDALEN had sailed from Quebec on May 20, 1776,",Magdalen,Magdalen,note,/TaggedPDF-doc/doc[592]/note[1]/ship
NDAR_V05_0593,Canceaux,MASTER'S LOG OF H.M. ARMED VESSEL CANCEAUX June 1776 Cape Sambro No 47 E' 28,Canceaux,CANCEAUX,title,/TaggedPDF-doc/doc[593]/title/ship
NDAR_V05_0593,Canceaux,"guns had been stowed in the hold of the CANCEAUX at Portsmouth on April 10, 1776.",Canceaux,Canceaux,note,/TaggedPDF-doc/doc[593]/note[1]/ship
NDAR_V05_0593,Canceaux,"guns had been stowed in the hold of the CANCEAUX at Portsmouth on April 10, 1776.",Canceaux,Canceaux,note,/TaggedPDF-doc/doc[593]/note[2]/ship[1]
NDAR_V05_0593,Albany (Sloop),re 16-6 Pounders and 16 Swivels for the ALBANY Sloop. ー 2Fresh gales and Cloudy with r,Albany,Albany,note,/TaggedPDF-doc/doc[593]/note[2]/ship[2]
NDAR_V05_0594,Cerberus,"JOURNAL OF H.M.S. CERBERUS , CAPTAIN JOHN SYMONS June 1776 Sa",Cerberus,CERBERUS,title,/TaggedPDF-doc/doc[594]/title/ship
NDAR_V05_0594,Hawk (Schooner),with rain P M reeft Topslsat 5 A M the HAWK Schooner broke the Hawser that was fast,Hawk,Hawk,p2,/TaggedPDF-doc/doc[594]/docBody/p2[2]/ship
NDAR_V05_0594,Cerberus,"1. PRO, Admiralty 51/181. 2. The CERBERUS and her prizes arrived at Halifax on Ju",Cerberus,Cerberus,note,/TaggedPDF-doc/doc[594]/note/ship
NDAR_V05_0595,Rockinham,Mr Samuel Gerrys Requst Conserning the ROCKINHAM ー the Reasion why She was Sesed Was as,Rockinham,Rockinham,p2,/TaggedPDF-doc/doc[595]/docBody/p2[1]/ship
NDAR_V05_0598,Hester (Sloop),TUPPER TO GEORGE WASHINGTON Sloop HESTER June the 4th 1776 ー 6 oclock PM S,Hester,Hester,dl,/TaggedPDF-doc/doc[598]/dl/ship
NDAR_V05_0598,Mercurey,tioned will Sail out under Convoy of sd MERCUREY . I shall Send to the Armd Vessels on th,Mercurey,Mercurey,p2,/TaggedPDF-doc/doc[598]/docBody/p2/ship[1]
NDAR_V05_0598,Lively,e men more last Night Desarted from the LIVELY man of war Who is Directly from Halifax,Lively,Lively,p2,/TaggedPDF-doc/doc[598]/docBody/p2/ship[2]
NDAR_V05_0599,Hester (Sloop),GEORGE WASHINGTON Sir Sloop HESTER June 4th 1776. There was two ship,Hester,Hester,dl,/TaggedPDF-doc/doc[599]/dl/ship
NDAR_V05_0599,Asia,Vessels & five small scraft besides the ASIA & her small Tender. It is thought (but,Asia,Asia,p,/TaggedPDF-doc/doc[599]/docBody/p/ship[1]
NDAR_V05_0599,Roe Buck,"the Vessels which lately arrived is the ROE-BUCK the Mercury, & the Liverpool ー Yesterda",Roe Buck,Roe-buck,p,/TaggedPDF-doc/doc[599]/docBody/p/ship[2]
NDAR_V05_0599,Mercury,"hich lately arrived is the Roe-buck the MERCURY , & the Liverpool ー Yesterday morning th",Mercury,Mercury,p,/TaggedPDF-doc/doc[599]/docBody/p/ship[3]
NDAR_V05_0599,Liverpool,"ived is the Roe-buck the Mercury, & the LIVERPOOL ー Yesterday morning three men made thei",Liverpool,Liverpool,p,/TaggedPDF-doc/doc[599]/docBody/p/ship[4]
NDAR_V05_0600,Liverpool,"exchange of the prisoners on board the LIVERPOOL ; Provided always, that this shall not b",Liverpool,Liverpool,p,/TaggedPDF-doc/doc[600]/docBody/p[3]/ship
NDAR_V05_0601,Roebuck,afety with neglect in the affair of the ROEBUCK &c After a good deal of altercation the,Roebuck,Roebuck,p,/TaggedPDF-doc/doc[601]/docBody/p/ship
NDAR_V05_0601,Polly,"Bradford Papers, HSP. 2. For the POLLY , Philip Lacey, master.",Polly,Polly,note,/TaggedPDF-doc/doc[601]/note/ship
NDAR_V05_0603,Two Brothers (Sloop),"April last they loaded their sloop the TWO BROTHERS , with a suitable cargo for the Island o",Two Brothers,two brothers,p,/TaggedPDF-doc/doc[603]/docBody/p[1]/ship[1]
NDAR_V05_0603,Lilly,"Virginia, in an armed sloop called the LILLY , with force of arms violently seized an",Lilly,Lilly,p,/TaggedPDF-doc/doc[603]/docBody/p[1]/ship[2]
NDAR_V05_0604,Bristol,"ce learned that the Men of War were the BRISTOL of 50 Guns, on board of which the Commo",Bristol,Bristol,p,/TaggedPDF-doc/doc[604]/docBody/p/ship[1]
NDAR_V05_0604,Solebay,"f which the Commodore had his Flag; the SOLEBAY , Capt. [Thomas] Symonds, 28; Syren Capt",Solebay,Solebay,p,/TaggedPDF-doc/doc[604]/docBody/p/ship[2]
NDAR_V05_0604,Syren,"he Solebay, Capt. [Thomas] Symonds, 28; SYREN Capt [Tobias] Furneaux, 28; Active, Cap",Syren,Syren,p,/TaggedPDF-doc/doc[604]/docBody/p/ship[3]
NDAR_V05_0604,Active,", 28; Syren Capt [Tobias] Furneaux, 28; ACTIVE , Capt. [William] Williams, 28; Actaeon,",Active,Active,p,/TaggedPDF-doc/doc[604]/docBody/p/ship[4]
NDAR_V05_0604,Actaeon,"; Active, Capt. [William] Williams, 28; ACTAEON , Capt. [Christopher] Atkins, 28; Sphinx",Actaeon,Actaeon,p,/TaggedPDF-doc/doc[604]/docBody/p/ship[5]
NDAR_V05_0604,Sphinx,"ctaeon, Capt. [Christopher] Atkins, 28; SPHINX , Capt. [Anthony] Hunt, 20; Ranger Sloop",Sphinx,Sphinx,p,/TaggedPDF-doc/doc[604]/docBody/p/ship[6]
NDAR_V05_0604,Ranger (Sloop),", 28; Sphinx, Capt. [Anthony] Hunt, 20; RANGER Sloop of 8; Thunder Bomb of 6 Guns and",Ranger,Ranger,p,/TaggedPDF-doc/doc[604]/docBody/p/ship[7]
NDAR_V05_0604,Thunder,"[Anthony] Hunt, 20; Ranger Sloop of 8; THUNDER Bomb of 6 Guns and 2 Mortars, one of th",Thunder,Thunder,p,/TaggedPDF-doc/doc[604]/docBody/p/ship[8]
NDAR_V05_0604,Friendship,"the other 11; an armed Ship called the FRIENDSHIP , of 18 Guns, with some smaller Vessels.",Friendship,Friendship,p,/TaggedPDF-doc/doc[604]/docBody/p/ship[9]
NDAR_V05_0606,St. Lawrence (Schooner),"JOURNAL OF H.M. SCHOONER ST. LAWRENCE , LIEUTENANT JOHN GRAVES June 1776",St. Lawrence,ST. LAWRENCE,title,/TaggedPDF-doc/doc[606]/title/ship
NDAR_V05_0606,Sphynx,pr order of Capt [Anthony] Hunt in the SPHYNX to cover two boats that was sounding on,Sphynx,Sphynx,p2,/TaggedPDF-doc/doc[606]/docBody/p2[1]/ship
NDAR_V05_0607,Triton,"JOURNAL OF H.M.S. TRITON , CAPTAIN SKEFFINGTON LUTWIDGE Jun",Triton,TRITON,title,/TaggedPDF-doc/doc[607]/title/ship
NDAR_V05_0608,Chatham,ER MARRIOT ARBUTHNOT (Copy) CHATHAM in Halifax Harbour the 5th June 1776.,Chatham,Chatham,dl,/TaggedPDF-doc/doc[608]/dl/ship
NDAR_V05_0608,Savage,"Orders are left with you1stI intend the SAVAGE , as a Convoy and protection for the Col",Savage,Savage,p,/TaggedPDF-doc/doc[608]/docBody/p[1]/ship
NDAR_V05_0608,Tamer,"Talbot's Orders are left with you.2dThe TAMER is expected with Forage for the Army, w",Tamer,Tamer,p,/TaggedPDF-doc/doc[608]/docBody/p[2]/ship[1]
NDAR_V05_0608,Niger,"Convoy) are to Sail under Convoy of the NIGER , whose Commander must be particularly e",Niger,Niger,p,/TaggedPDF-doc/doc[608]/docBody/p[2]/ship[2]
NDAR_V05_0608,Tamer,"Talbot's Orders are left with you.2dThe TAMER is expected with Forage for the Army, w",Tamer,Tamer,p,/TaggedPDF-doc/doc[608]/docBody/p[2]/ship[3]
NDAR_V05_0608,Tamer,"Talbot's Orders are left with you.2dThe TAMER is expected with Forage for the Army, w",Tamer,Tamer,p,/TaggedPDF-doc/doc[608]/docBody/p[2]/ship[4]
NDAR_V05_0608,Niger,"Convoy) are to Sail under Convoy of the NIGER , whose Commander must be particularly e",Niger,Niger,p2,/TaggedPDF-doc/doc[608]/docBody/p2[3]/ship
NDAR_V05_0608,Albany,"the necessary Measures for getting the ALBANY ready for Sea, as soon as the King's Se",Albany,Albany,p,/TaggedPDF-doc/doc[608]/docBody/p[3]/ship
NDAR_V05_0610,Susannah (Ship),or late Master & Cheif Mate of the Ship SUSANNAH Humbly Sheweth ーThat your Petitioners s,Susannah,Susannah,p,/TaggedPDF-doc/doc[610]/docBody/p[1]/ship
NDAR_V05_0610,Susannah (Ship),or late Master & Cheif Mate of the Ship SUSANNAH Humbly Sheweth ーThat your Petitioners s,Susannah,Susannah,note,/TaggedPDF-doc/doc[610]/note[1]/ship
NDAR_V05_0610,George (Ship),"3. Emms had been master of the ship GEORGE with a cargo of 1,900 barrels of flour.",George,George,note,/TaggedPDF-doc/doc[610]/note[2]/ship
NDAR_V05_0612,Nancy (Sloop),and Peleg Crocker ー owners of the Sloop NANCY ー setting forth ー That said Sloop was t,Nancy,Nancy,p,/TaggedPDF-doc/doc[612]/docBody/p/ship
NDAR_V05_0612,Nancy (Sloop),and Peleg Crocker ー owners of the Sloop NANCY ー setting forth ー That said Sloop was t,Nancy,Nancy,note,/TaggedPDF-doc/doc[612]/note/ship
NDAR_V05_0614,Reynolds (Ship),"Letters, I, 245, 255. 2. The ship REYNOLDS , one of three sugar ships from Jamaica,",Reynolds,Reynolds,note,/TaggedPDF-doc/doc[614]/note[1]/ship[1]
NDAR_V05_0614,Congress,"a, taken by the Pennsylvania privateers CONGRESS and Chance. 3. The resolution of",Congress,Congress,note,/TaggedPDF-doc/doc[614]/note[1]/ship[2]
NDAR_V05_0614,Chance,"he Pennsylvania privateers Congress and CHANCE . 3. The resolution of April 3, 17",Chance,Chance,note,/TaggedPDF-doc/doc[614]/note[1]/ship[3]
NDAR_V05_0615,John and Joseph (Schooner),"nd Papers, NLCHS. 2. The schooner JOHN AND JOSEPH , retaken April 12, 1776. She had been N",John and Joseph,John and Joseph,note,/TaggedPDF-doc/doc[615]/note[1]/ship[1]
NDAR_V05_0615,Scarborough,s property before her capture by H.M.S. SCARBOROUGH . 3. Levi Hollingsworth and Thomas,Scarborough,Scarborough,note,/TaggedPDF-doc/doc[615]/note[1]/ship[2]
NDAR_V05_0617,Warren,hen sitting to appoint Officers for the WARREN F[ri]gate ー A[s] I had been in the Cade,Warren,Warren,note,/TaggedPDF-doc/doc[617]/note/ship[1]
NDAR_V05_0617,Warren,hen sitting to appoint Officers for the WARREN F[ri]gate ー A[s] I had been in the Cade,Warren,Warren,note,/TaggedPDF-doc/doc[617]/note/ship[2]
NDAR_V05_0618,Tryon (Sloop),"rter Master General, on board the Sloop TRYON , Barent Van Alen Master, & to be delive",Tryon,Tryon,p,/TaggedPDF-doc/doc[618]/docBody/p/ship
